URL,Headingonly,Title,DATE INDICATOR,Heading,Created,By,Location,Raised,raised as number,raised as words,target as number,Oftarget,Supporters,Supporters/investors,Timeleft 3,Timeleft 4,Category,Heading 2,Heading 3,Raisedby,Startedon
https://www.crowdfunder.co.uk/nunfestlondon,Help make Nunfest 2020 music festival happen! ,Help make Nunfest 2020 music festival happen! - a Music crowdfunding project in London by Joe Downie,2020-02-17T19:08:00+00:00,Help make Nunfest 2020 music festival happen!,2020-02-17T19:08:00+00:00,Joe Downie in,"London, England, United Kingdom",558,558,"raised of £2,000 target",2000,"2,000",21,supporters,27%,9 days left,Music,,,,
https://www.crowdfunder.co.uk/mind-over-money,Mind over money ,Mind over money - This is an emergency - a Community crowdfunding project in Bath by Douglas Eason,84 days left,Mind over money - This is an emergency,,Douglas Eason in,"Bath, England, United Kingdom",552,552,"raised of £13,500 target",13500,"13,500",8,supporters,4%,84 days left,Community,,,,
https://www.crowdfunder.co.uk/please-help-us-survive-the-covid-19-shutdown,Please help us survive the Covid-19 Shutdown ,Please help us survive the Covid-19 Shutdown - a Business crowdfunding project in Madeley by Press Red Rentals Limited,2020-04-17T15:31:03+01:00,Please help us survive the Covid-19 Shutdown,2020-04-17T15:31:03+01:00,Press Red Rentals Limited in,"Madeley, England, United Kingdom",550,550,"raised of £20,000 target",20000,"20,000",2,supporters,2%,9 days left,Business,,,,
https://www.crowdfunder.co.uk/the-royal-gunpowder-mills-needs-help,The Royal Gunpowder Mills Needs Your Help ,The Royal Gunpowder Mills Needs Your Help - a Charities crowdfunding project in Waltham Abbey by Royal Gunpowder Mills,14 days left,The Royal Gunpowder Mills Needs Your Help,,Royal Gunpowder Mills in,"Waltham Abbey, England, United Kingdom",550,550,"raised of £20,000 target",20000,"20,000",22,supporters,2%,14 days left,Charities,,,,
https://www.crowdfunder.co.uk/surviving-covid19,Surviving COVID19 ,Surviving COVID19 - a Business crowdfunding project in Crossways by Dorchester Mini Centre,9 days left,Surviving COVID19,,Dorchester Mini Centre in,"Crossways, England, United Kingdom",546,546,"raised of £3,000 target",3000,"3,000",9,supporters,18%,9 days left,Business,,,,
https://www.crowdfunder.co.uk/football-club-kebab-machine,Football club kebab machine ,Football club kebab machine - a Charities crowdfunding project in Millbrook by Jeremy Hancock,26 days left,Football club kebab machine,,Jeremy Hancock in,"Millbrook, England, United Kingdom",540,540,raised of £750 target,750,750,25,supporters,72%,26 days left,Charities,,,,
https://www.crowdfunder.co.uk/help-protect-our-services-by-protecting-muchness,"Help Protect our Services, By Protecting Muchness! ","Help Protect our Services, By Protecting Muchness! - a Business crowdfunding project in London by Muchness Ltd",2020-04-20T16:00:03+01:00,"Help Protect our Services, By Protecting Muchness!",2020-04-20T16:00:03+01:00,Muchness Ltd in,"London, England, United Kingdom",540,540,"raised of £1,000 target",1000,"1,000",6,supporters,54%,26 days left,Business,,,,
https://www.crowdfunder.co.uk/rosie-lea-launch-at-last,Rosie Lea Launch at Last ,"Rosie Lea Launch at Last - a Business crowdfunding project in Boldre by Rachel Rabbetts, Rosie Lea",51 days left,Rosie Lea Launch at Last,,"Rachel Rabbetts, Rosie Lea in","Boldre, England, United Kingdom",540,540,"raised of £2,500 target",2500,"2,500",5,supporters,21%,51 days left,Business,,,,
https://www.crowdfunder.co.uk/st-cuthbert-infant-school-friends-of-school,Friends of St Cuthbert's Infant School ,Friends of St Cuthbert's Infant School - a Community crowdfunding project in Wells by Friends of St Cuthbert's Infants,84 days left,Friends of St Cuthbert's Infant School,,Friends of St Cuthbert's Infants in,"Wells, England, United Kingdom",535,535,"raised of £2,000 target",2000,"2,000",9,supporters,26%,84 days left,Community,,,,
https://www.crowdfunder.co.uk/aspiring-learners,Aspiring Learners ,Aspiring Learners - a Charities crowdfunding project in Stirling by Children’s University Scotland,2020-03-03T23:59:59+00:00,Aspiring Learners,2020-03-03T23:59:59+00:00,Children’s University Scotland in,"Stirling, Scotland, United Kingdom",534,534,"raised of £10,000 target",10000,"10,000",14,supporters,5%,84 days left,Charities,,,,
https://www.crowdfunder.co.uk/portsmouth-princess,Princess to bring sparkle to Portsmouth Community ,Princess to bring sparkle to Portsmouth Community - a Business crowdfunding project in Southsea by Princess Sassy,17 days left,Princess to bring sparkle to Portsmouth Community,,Princess Sassy in,"Southsea, England, United Kingdom",530,530,"raised of £1,000 target",1000,"1,000",24,supporters,53%,17 days left,Business,,,,
https://www.crowdfunder.co.uk/winefreedom,HELP LAUNCH CENTRAL BHAM'S 1ST NATURAL WINE VENUE ,HELP LAUNCH CENTRAL BHAM'S 1ST NATURAL WINE VENUE - a Food and Drink crowdfunding project in Birmingham by Wine Freedom,39 days left,HELP LAUNCH CENTRAL BHAM'S 1ST NATURAL WINE VENUE,,Wine Freedom in,"Birmingham, England, United Kingdom",530,530,"raised of £25,000 target",25000,"25,000",12,supporters,2%,39 days left,Food and Drink,,,,
https://www.crowdfunder.co.uk/thank-you-to-norfolk-nhs,A BIG thank you to our Norfolk NHS workers ,A BIG thank you to our Norfolk NHS workers - a Charities crowdfunding project in Sheringham by Chris Taylor,4 days left,A BIG thank you to our Norfolk NHS workers,,Chris Taylor in,"Sheringham, England, United Kingdom",528,528,"raised of £1,000 target",1000,"1,000",40,supporters,52%,4 days left,Charities,,,,
https://www.crowdfunder.co.uk/bamboobanditart,Help keep Bamboo Bandit out of trouble ,Help keep Bamboo Bandit out of trouble - a Business crowdfunding project in Weston Super Mare by Bamboo Bandit Art,30 days left,Help keep Bamboo Bandit out of trouble,,Bamboo Bandit Art in,"Weston Super Mare, England, United Kingdom",527,527,"raised of £1,000 stretch target",1000,"1,000 stretch",,supporters,53%,30 days left,Business,,,,
https://www.crowdfunder.co.uk/support-handmade-with-rustic-love,Support handmade with rustic love and Lincoln nhs ,Support handmade with rustic love and Lincoln nhs - a Business crowdfunding project in Welton by Adam Carr,5 days left,Support handmade with rustic love and Lincoln nhs,,Adam Carr in,"Welton, England, United Kingdom",527,527,"raised of £4,000 target",4000,"4,000",22,supporters,13%,5 days left,Business,,,,
https://www.crowdfunder.co.uk/ruhelping-victims,Running a marathon to help preventing bullying ,Running a marathon to help preventing bullying - a crowdfunding project in London by Marco Diciolla,24 days left,Running a marathon to help preventing bullying,,,,526,526,raised of £500 target,500,500,19,supporters,105%,24 days left,Charities,,,,
https://www.crowdfunder.co.uk/we-are-stronger-charity,We Are Stronger Charity ,We Are Stronger Charity - a Charities crowdfunding project in London by We Are Stranger Charity,69 days left,We Are Stronger Charity,,,,526,526,"raised of £5,000 target",5000,"5,000",19,supporters,10%,69 days left,Charities,We Are Stronger Charity,,,
https://www.crowdfunder.co.uk/wellbeing-classes-for-neuro-diverse-children,Online wellbeing classes for autistic children ,Online wellbeing classes for autistic children - a Social Enterprise crowdfunding project in Oxley Park by Cheryl Kennedy,2020-03-03T23:59:59+00:00,Online wellbeing classes for autistic children,2020-03-03T23:59:59+00:00,Cheryl Kennedy in,"Oxley Park, England, United Kingdom",522,522,"raised of £10,000 target",10000,"10,000",10,supporters,5%,84 days left,Social Enterprise,,,,
https://www.crowdfunder.co.uk/helpthemagpiesfly,Help the Magpies fly through the Covid-19 crisis ,Help the Magpies fly through the Covid-19 crisis - a Business crowdfunding project in Chorley by Chorley FC,26 days left,Help the Magpies fly through the Covid-19 crisis,,Chorley FC in,"Chorley, England, United Kingdom",520,520,"raised of £5,000 target",5000,"5,000",27,supporters,10%,26 days left,Business,,,,
https://www.crowdfunder.co.uk/kiki-tots-nursery,Kiki Tots Childcare ,Kiki Tots Childcare - a Social Enterprise crowdfunding project in Frant by Kiki Whittle,8 days left,Kiki Tots Childcare,,Kiki Whittle in,"Frant, England, United Kingdom",520,520,"raised of £10,000 target",10000,"10,000",3,supporters,5%,8 days left,Social Enterprise,,,,
https://www.crowdfunder.co.uk/city-arts-newbury-accessible-facilities,City Arts Newbury: Accessible toilet facilities ,City Arts Newbury: Accessible toilet facilities - a Community crowdfunding project in Newbury by CLaire Struthers-Semple,84 days left,City Arts Newbury: Accessible toilet facilities,,CLaire Struthers-Semple in,"Newbury, England, United Kingdom",519,519,"raised of £2,500 target",2500,"2,500",16,supporters,20%,84 days left,Community,,,,
https://www.crowdfunder.co.uk/veteran-1,Veteran classic restoration project ,Veteran classic restoration project - a Food and Drink crowdfunding project in Eccles by Dan Redshaw,2020-03-03T23:59:59+00:00,Veteran classic restoration project,2020-03-03T23:59:59+00:00,Dan Redshaw in,"Eccles, England, United Kingdom",519,519,"raised of £35,000 target",35000,"35,000",12,supporters,1%,84 days left,Food and Drink,,,,
https://www.crowdfunder.co.uk/ppe4lcr,PPE 4 LCR Key Workers ,PPE 4 LCR Key Workers - a Charities crowdfunding project in Prenton by Andy Corkhill,2020-04-16T11:38:40+01:00,PPE 4 LCR Key Workers,2020-04-16T11:38:40+01:00,Andy Corkhill in,"Prenton, England, United Kingdom",513,513,"raised of £5,000 target",5000,"5,000",23,supporters,10%,22 days left,Charities,,,,
https://www.crowdfunder.co.uk/fund-our-fleet-help-us-keep-our-vehicles-moving,Fund Our Fleet: Help Us Keep Our Vehicles Moving ,Fund Our Fleet: Help Us Keep Our Vehicles Moving - a Heritage crowdfunding project in Leicester by Steven Foxon (LTHT Volunteer),7 days left,Fund Our Fleet: Help Us Keep Our Vehicles Moving,,Steven Foxon (LTHT Volunteer) in,"Leicester, England, United Kingdom",511,511,"raised of £2,500 target",2500,"2,500",22,supporters,20%,7 days left,Heritage,,,,
https://www.crowdfunder.co.uk/amys-house-charity-shop,Amy's House charity shop ,Amy's House charity shop - a Charities crowdfunding project in Sheffield by Nicola Cockayne,84 days left,Amy's House charity shop,,Nicola Cockayne in,"Sheffield, England, United Kingdom",510,510,"raised of £1,000 stretch target",1000,"1,000 stretch",,supporters,51%,84 days left,Charities,,,,
https://www.crowdfunder.co.uk/support-us-during-the-covid19-crisis,Support us during the COVID19 crisis ,Support us during the COVID19 crisis - a Business crowdfunding project in Billingham by Sunshine Wood,27 days left,Support us during the COVID19 crisis,,Sunshine Wood in,"Billingham, England, United Kingdom",510,510,"raised of £5,000 target",5000,"5,000",18,supporters,10%,27 days left,Business,,,,
https://www.crowdfunder.co.uk/bikes-for-nhs,Bikes for NHS ,Bikes for NHS - a Community crowdfunding project in Liverpool by HYPE Merseyside,2020-04-15T15:40:45+01:00,Bikes for NHS,2020-04-15T15:40:45+01:00,HYPE Merseyside in,"Liverpool, England, United Kingdom",510,510,"raised of £20,000 target",20000,"20,000",11,supporters,2%,35 days left,Community,,,,
https://www.crowdfunder.co.uk/support-barcelona-tapas-bar,Support Barcelona Tapas ,Support Barcelona Tapas - Prepaid Rewards - a Business crowdfunding project in London by David Dalmau,54 days left,Support Barcelona Tapas - Prepaid Rewards,,David Dalmau in,"London, England, United Kingdom",510,510,"raised of £35,000 target",35000,"35,000",8,supporters,1%,54 days left,Business,,,,
https://www.crowdfunder.co.uk/keeping-chalk-farm-ldc-going,Keeping Chalk Farm LDC going! ,Keeping Chalk Farm LDC going! - a Charities crowdfunding project in Eastbourne by Chalk Farm LDC,10 days left,Keeping Chalk Farm LDC going!,,Chalk Farm LDC in,"Eastbourne, England, United Kingdom",508,508,"raised of £5,000 target",5000,"5,000",18,supporters,10%,10 days left,Charities,,,,
https://www.crowdfunder.co.uk/the-teapot-project,The Teapot Project ,The Teapot Project - a Food and Drink crowdfunding project in Woodbridge by The Teapot Project,49 days left,The Teapot Project,,The Teapot Project in,"Woodbridge, England, United Kingdom",505,505,"raised of £2,132 target",2132,"2,132",14,supporters,23%,49 days left,Food and Drink,,,,
https://www.crowdfunder.co.uk/library-refeb-1,Firs Farm School Community Library ,Firs Farm School Community Library - a Community crowdfunding project in London by Firs Farm School Association,2020-03-03T23:59:59+00:00,Firs Farm School Community Library,2020-03-03T23:59:59+00:00,Firs Farm School Association in,"London, England, United Kingdom",505,505,"raised of £5,000 target",5000,"5,000",23,supporters,10%,84 days left,Community,,,,
https://www.crowdfunder.co.uk/wellbeing-breaks-for-disadvantaged-hidden-heroes,Wellbeing Breaks for Disadvantaged Hidden Heroes ,Wellbeing Breaks for Disadvantaged Hidden Heroes - a Community crowdfunding project in Christchurch by Room to Reward,2020-03-03T23:59:59+00:00,Wellbeing Breaks for Disadvantaged Hidden Heroes,2020-03-03T23:59:59+00:00,Room to Reward in,"Christchurch, England, United Kingdom",502,502,raised of £750 target,750,750,8,supporters,66%,84 days left,Community,,,,
https://www.crowdfunder.co.uk/feed-a-family-in-need-with-the-boro,Feed a Family in Need with the Boro' ,Feed a Family in Need with the Boro' - a Sports crowdfunding project in Gosport by Gosport Borough Football Club,26 days left,Feed a Family in Need with the Boro,,Gosport Borough Football Club in,"Gosport, England, United Kingdom",502,502,"raised of £2,500 target",2500,"2,500",27,supporters,20%,26 days left,Sports,,,,
https://www.crowdfunder.co.uk/the-health-hub-project-launch,The Health Hub Project Launch ,The Health Hub Project Launch - a Community crowdfunding project in Bournemouth by Robyn Eede,2020-02-29T11:48:00+00:00,The Health Hub Project Launch,2020-02-29T11:48:00+00:00,Robyn Eede in,"Bournemouth, England, United Kingdom",500,500,"raised of £1,000 stretch target",1000,"1,000 stretch",,supporters,50%,2 days left,Community,,,,
https://www.crowdfunder.co.uk/perthshirepride,Perthshire Pride 2020 ,Perthshire Pride 2020 - a Community crowdfunding project in Perth by Claire Mackenzie,2020-03-04T23:59:00+00:00,Perthshire Pride 2020,2020-03-04T23:59:00+00:00,Claire Mackenzie in,"Perth, Scotland, United Kingdom",500,500,"raised of £1,000 stretch target",1000,"1,000 stretch",,supporters,50%,84 days left,Community,,,,
https://www.crowdfunder.co.uk/mains-big-build,MAIN's Big Build ,MAIN's Big Build - a Community crowdfunding project in Middlesbrough by MAIN - Taking Autism Personally,2020-03-04T23:59:00+00:00,MAIN's Big Build,2020-03-04T23:59:00+00:00,MAIN - Taking Autism Personally in,"Middlesbrough, England, United Kingdom",500,500,"raised of £20,000 stretch target",20000,"20,000 stretch",,supporters,3%,84 days left,Community,,,,
https://www.crowdfunder.co.uk/lets-beat-covid-19,Lets beat Covid 19 ,Lets beat Covid 19 - a Community crowdfunding project in Spondon by Charles Swanson,6 days left,Lets beat Covid 19,,Charles Swanson in,"Spondon, England, United Kingdom",500,500,"raised of £50,000 target",50000,"50,000",17,supporters,1%,6 days left,Community,,,,
https://www.crowdfunder.co.uk/lifesavers-north-east,Let’s Teach Children How To Be Smart With Money! ,Let’s Teach Children How To Be Smart With Money! - a Community crowdfunding project in Newcastle Upon Tyne by Just Finance Foundation,2020-03-03T23:59:59+00:00,Let’s Teach Children How To Be Smart With Money!,2020-03-03T23:59:59+00:00,Just Finance Foundation in,"Newcastle Upon Tyne, England, United Kingdom",499,499,"raised of £3,500 target",3500,"3,500",18,supporters,14%,84 days left,Community,,,,
https://www.crowdfunder.co.uk/money-and-me,Money And Me ,Money And Me - a Charities crowdfunding project in Eastwood Trading Estate by Annie Ferguson,84 days left,Money And Me,,Annie Ferguson in,"Eastwood Trading Estate, England, United Kingdom",498,498,"raised of £15,000 target",15000,"15,000",14,supporters,3%,84 days left,Charities,,,,
https://www.crowdfunder.co.uk/let-children-be-children,Let Children BE Children ,Let Children BE Children - a Community crowdfunding project in Easington Lane by Gateway North East,26 days left,Let Children BE Children,,Gateway North East in,"Easington Lane, England, United Kingdom",497,497,"raised of £2,000 target",2000,"2,000",6,supporters,24%,26 days left,Community,,,,
https://www.crowdfunder.co.uk/save-our-seafair-artists,SAVE OUR SEAFAIR ARTISTS ,SAVE OUR SEAFAIR ARTISTS - a Community crowdfunding project in Bridport by SEAFAIR Artists,20 days left,SAVE OUR SEAFAIR ARTISTS,,SEAFAIR Artists in,"Bridport, England, United Kingdom",492,492,"raised of £3,500 target",3500,"3,500",30,supporters,14%,20 days left,Community,,,,
https://www.crowdfunder.co.uk/support-the-early-bird-buy-now-brunch-later,"Support The Early Bird. Buy now, brunch later. ","Support The Early Bird. Buy now, brunch later. - a Business crowdfunding project in Plymouth by The Early Bird Plymouth",22 days left,"Support The Early Bird. Buy now, brunch later.",,The Early Bird Plymouth in,"Plymouth, England, United Kingdom",492,492,"raised of £10,000 target",10000,"10,000",22,supporters,4%,22 days left,Business,,,,
https://www.crowdfunder.co.uk/the-wellbeing-revolution,The Wellbeing Revolution Vital Online Help ,The Wellbeing Revolution Vital Online Help - a Business crowdfunding project in Catrine by Melanie McLean,51 days left,The Wellbeing Revolution Vital Online Help,,Melanie McLean in,"Catrine, Scotland, United Kingdom",490,490,"raised of £2,000 target",2000,"2,000",21,supporters,24%,51 days left,Business,,,,
https://www.crowdfunder.co.uk/help-acsos-survive-corvid19,Help Age Concern Southend Survive Corvid-19! ,Help Age Concern Southend Survive Corvid-19! - a Community crowdfunding project in Westcliff On Sea by Claire Slack,2020-04-06T17:02:35+01:00,Help Age Concern Southend Survive Corvid-19!,2020-04-06T17:02:35+01:00,Claire Slack in,"Westcliff On Sea, England, United Kingdom",490,490,"raised of £10,000 target",10000,"10,000",19,supporters,4%,12 days left,Community,,,,
https://www.crowdfunder.co.uk/hob-angel,Home safety device for people with dementia and MS ,Home safety device for people with dementia and MS - a Business crowdfunding project in Alloa by Jordan Shaw Ltd,2020-04-14T10:30:56+01:00,Home safety device for people with dementia and MS,2020-04-14T10:30:56+01:00,Jordan Shaw Ltd in,"Alloa, Scotland, United Kingdom",490,490,"raised of £250,000 target",250000,"250,000",11,supporters,0%,47 days left,Business,,,,
https://www.crowdfunder.co.uk/oursideyouth,Young Peoples Mental Health Ambassador Project ,Young Peoples Mental Health Ambassador Project - a Community crowdfunding project in Evesham by Ourside Youth Association,2020-03-03T23:59:59+00:00,Young Peoples Mental Health Ambassador Project,2020-03-03T23:59:59+00:00,Ourside Youth Association in,"Evesham, England, United Kingdom",487,487,"raised of £2,593 target",2593,"2,593",6,supporters,18%,84 days left,Community,,,,
https://www.crowdfunder.co.uk/buynowredeemlater,Lots of Walks Buy Walks Now & Redeem Later ,Lots of Walks Buy Walks Now & Redeem Later - a Business crowdfunding project in Timperley by Helen Riley,2 days left,Lots of Walks Buy Walks Now & Redeem Later,,,,487,487,"raised of £3,000 target",3000,"3,000",8,supporters,16%,2 days left,Business,Lots of Walks Buy Walks Now & Redeem Later,,,
https://www.crowdfunder.co.uk/foodforthefuture,Community Food for the Future ,Community Food for the Future - a Food and Drink crowdfunding project in Great Yarmouth by Edfords Care Farm,84 days left,Community Food for the Future,,Edfords Care Farm in,"Great Yarmouth, England, United Kingdom",487,487,"raised of £6,500 target",6500,"6,500",6,supporters,7%,84 days left,Food and Drink,,,,
https://www.crowdfunder.co.uk/capturing-moments-creating-memories-to-treasure,Capturing Moments & Creating Memories to Treasure ,Capturing Moments & Creating Memories to Treasure - a Business crowdfunding project in Goring By Sea by Kate Henwood,33 days left,Capturing Moments & Creating Memories to Treasure,,Kate Henwood in,"Goring By Sea, England, United Kingdom",485,485,"raised of £5,000 target",5000,"5,000",12,supporters,9%,33 days left,Business,,,,
https://www.crowdfunder.co.uk/help-common-get-through-this,Help Common get through this! ,Help Common get through this! - a Business crowdfunding project in London by Elizabeth Smalley,20 days left,Help Common get through this!,,Elizabeth Smalley in,"London, England, United Kingdom",482,482,"raised of £10,000 target",10000,"10,000",14,supporters,4%,20 days left,Business,,,,
https://www.crowdfunder.co.uk/help-duke-fortune,Duke & Fortune-Help Us Get Started ,Duke & Fortune-Help Us Get Started - a Arts crowdfunding project in Irthlingborough by Duke & Fortune,12 days left,Duke & Fortune-Help Us Get Started,,Duke & Fortune in,"Irthlingborough, England, United Kingdom",480,480,raised of £500 target,500,500,9,supporters,96%,12 days left,Arts,,,,
https://www.crowdfunder.co.uk/in-this-together,IN THIS TOGETHER ,IN THIS TOGETHER - a Charities crowdfunding project in Strabane by Strabane & District Playclub,37 days left,IN THIS TOGETHER,,Strabane & District Playclub in,"Strabane, Northern Ireland, United Kingdom",480,480,"raised of £10,000 target",10000,"10,000",8,supporters,4%,37 days left,Charities,,,,
https://www.crowdfunder.co.uk/psycho-education-for-survivors-of-domestic-abuse,Psycho Education for Survivors of Domestic Abuse ,Psycho Education for Survivors of Domestic Abuse - a Community crowdfunding project in Sutton by Sutton Women's Centre,84 days left,Psycho Education for Survivors of Domestic Abuse,,Sutton Women's Centre in,"Sutton, England, United Kingdom",477,477,"raised of £1,000 target",1000,"1,000",5,supporters,47%,84 days left,Community,,,,
https://www.crowdfunder.co.uk/level-1-award-in-coaching-golf,Coaching Golf in the Community ,Coaching Golf in the Community - Wounded Veterans - a Charities crowdfunding project in Wishaw by On Course Foundation,2020-03-03T23:59:59+00:00,Coaching Golf in the Community - Wounded Veterans,2020-03-03T23:59:59+00:00,On Course Foundation in,"Wishaw, England, United Kingdom",477,477,"raised of £1,200 target",1200,"1,200",5,supporters,39%,84 days left,Charities,,,,
https://www.crowdfunder.co.uk/caretocreate,Care to Create ,Care to Create - a Music crowdfunding project in Woking by INTERGENERATIONAL MUSIC MAKING,84 days left,Care to Create,,INTERGENERATIONAL MUSIC MAKING in,"Woking, England, United Kingdom",477,477,"raised of £2,000 target",2000,"2,000",5,supporters,23%,84 days left,Music,,,,
https://www.crowdfunder.co.uk/golden-memories,Golden memories ,Golden memories - a Charities crowdfunding project in Crewe by Geoff Beadle,2020-03-03T23:59:59+00:00,Golden memories,2020-03-03T23:59:59+00:00,Geoff Beadle in,"Crewe, England, United Kingdom",477,477,"raised of £7,445 target",7445,"7,445",5,supporters,6%,84 days left,Charities,,,,
https://www.crowdfunder.co.uk/mental-health-and-wellbeing-support-for-all,Mental Health and Wellbeing support for all ,Mental Health and Wellbeing support for all - a Community crowdfunding project in London by Mind in Haringey,29 days left,Mental Health and Wellbeing support for all,,Mind in Haringey in,"London, England, United Kingdom",475,475,"raised of £10,000 target",10000,"10,000",30,supporters,4%,29 days left,Community,,,,
https://www.crowdfunder.co.uk/helping-those-in-need-in-afghanistan,Helping those in need in Afghanistan ,Helping those in need in Afghanistan - a Personal Causes crowdfunding project in Afghanistan by Iqra Islam,19 days left,Helping those in need in Afghanistan,,Iqra Islam in,Afghanistan,474,474,"raised of £5,000 target",5000,"5,000",29,supporters,9%,19 days left,Personal Causes,,,,
https://www.crowdfunder.co.uk/running-for-georgia,I’m running the London Virgin marathon for Georgia ,I’m running the London Virgin marathon for Georgia - a Charities crowdfunding project in Ruddington by Marijke van Eerd,9 days left,I’m running the London Virgin marathon for Georgia,,Marijke van Eerd in,"Ruddington, England, United Kingdom",470,470,"raised of £1,000 target",1000,"1,000",28,supporters,47%,9 days left,Charities,,,,
https://www.crowdfunder.co.uk/let-us-come-together-for-our-community,Food for communities affected by COVID-19 ,Food for communities affected by COVID-19 - a Food and Drink crowdfunding project in London by LOVAGE PROJECT,8 days left,Food for communities affected by COVID-19,,LOVAGE PROJECT in,"London, England, United Kingdom",467,467,"raised of £2,000 target",2000,"2,000",27,supporters,23%,8 days left,Food and Drink,,,,
https://www.crowdfunder.co.uk/manchester-central-and-north-mini-scrub-hub,Manchester Central and North mini scrub hub ,Manchester Central and North mini scrub hub - a Community crowdfunding project in Manchester by Manchester Central mini hub,8 days left,Manchester Central and North mini scrub hub,,Manchester Central mini hub in,"Manchester, England, United Kingdom",465,465,"raised of £2,000 target",2000,"2,000",25,supporters,23%,8 days left,Community,,,,
https://www.crowdfunder.co.uk/funding-our-future,Funding our Future ,Funding our Future - a Business crowdfunding project in Taffs Well by The Taffs Well Inn,34 days left,Funding our Future,,The Taffs Well Inn in,"Taffs Well, Wales, United Kingdom",465,465,"raised of £5,000 target",5000,"5,000",15,supporters,9%,34 days left,Business,,,,
