URL,Headingonly,Title,DATE INDICATOR,Heading,Created,By,Location,Raised,raised as number,raised as words,target as number,Oftarget,Supporters,Supporters/investors,Timeleft 3,Timeleft 4,Category,Heading 2,Heading 3,Raisedby,Startedon
https://www.crowdfunder.co.uk/silent-mind-theatre-community-project,SILENT MIND THEATRE COMMUNITY PROJECT ,SILENT MIND THEATRE COMMUNITY PROJECT - a Community crowdfunding project in Southampton by THEATRE FOR LIFE CIC,2020-03-03T23:59:59+00:00,SILENT MIND THEATRE COMMUNITY PROJECT,2020-03-03T23:59:59+00:00,THEATRE FOR LIFE CIC in,"Southampton, England, United Kingdom","1,353",1353,"raised of £2,000 target",2000,"2,000",20,supporters,67%,84 days left,Community,,,,
https://www.crowdfunder.co.uk/mary-archie-didsbury-covid-19-support-2,Mary & Archie Didsbury Covid 19 Support ,Mary & Archie Didsbury Covid 19 Support - a Food and Drink crowdfunding project in Manchester by Mary & Archie,22 days left,Mary & Archie Didsbury Covid 19 Support,,Mary & Archie in,"Manchester, England, United Kingdom","1,348",1348,"raised of £4,000 target",4000,"4,000",38,supporters,33%,22 days left,Food and Drink,,,,
https://www.crowdfunder.co.uk/osc-cbdfit,Surviving covid19 ,Surviving covid19 - a Business crowdfunding project in Stafford by Slav Josephson,2020-03-29T09:15:00+01:00,Surviving covid19,2020-03-29T09:15:00+01:00,Slav Josephson in,"Stafford, England, United Kingdom","1,341",1341,"raised of £2,999 stretch target",2999,"2,999 stretch",,supporters,45%,38 days left,Business,,,,
https://www.crowdfunder.co.uk/captains-fund-1,Captains Fund ,Captains Fund - a Arts crowdfunding project in Edinburgh by.....Captain's Fund,28 days left,Captains Fund,,,,"1,335",1335,"raised of £18,000 target",18000,"18,000",43,supporters,7%,28 days left,Arts,Captains Fund,,,
https://www.crowdfunder.co.uk/save-trulys-from-the-covid-19-crisis,Save Truly's from the Covid-19 Crisis ,Save Truly's from the Covid-19 Crisis - a Business crowdfunding project in Bournemouth by Lauren Reading,1 day left,Save Truly's from the Covid-19 Crisis,,Lauren Reading in,"Bournemouth, England, United Kingdom","1,331",1331,"raised of £4,000 target",4000,"4,000",25,supporters,33%,1 day left,Business,,,,
https://www.crowdfunder.co.uk/rachelsrainbows,Rachel's Rainbows ,Rachel's Rainbows - a Community crowdfunding project in Wigan by Happy Smiles,42 days left,Rachel's Rainbows,,Happy Smiles in,"Wigan, England, United Kingdom","1,330",1330,"raised of £1,000 stretch target",1000,"1,000 stretch",,supporters,133%,42 days left,Community,,,,
https://www.crowdfunder.co.uk/afcp-covid19,AFC Portchester Covid-19 Mutual Support Group ,AFC Portchester Covid-19 Mutual Support Group - a Community crowdfunding project in Fareham by AFC Portchester,15 days left,AFC Portchester Covid-19 Mutual Support Group,,AFC Portchester in,"Fareham, England, United Kingdom","1,330",1330,"raised of £2,000 stretch target",2000,"2,000 stretch",,supporters,67%,15 days left,Community,,,,
https://www.crowdfunder.co.uk/river-gardens-caf,River Gardens Café ,River Gardens Café - a Business crowdfunding project in London by Dan Boardman,20 days left,River Gardens Café,,Dan Boardman in,"London, England, United Kingdom","1,320",1320,"raised of £5,000 stretch target",5000,"5,000 stretch",,supporters,26%,20 days left,Business,,,,
https://www.crowdfunder.co.uk/grange-pavilion-community-centre,Grange Pavilion Community Centre ,Grange Pavilion Community Centre - a Community crowdfunding project in Cardiff by Grange Pavilion,84 days left,Grange Pavilion Community Centre,,Grange Pavilion in,"Cardiff, Wales, United Kingdom","1,318",1318,"raised of £2,000 target",2000,"2,000",28,supporters,65%,84 days left,Community,,,,
https://www.crowdfunder.co.uk/lovelaceatelier,Help get Lovelace Atelier open after COVID-19! ,Help get Lovelace Atelier open after COVID-19! - a Business crowdfunding project in Southsea by April Lovelace,23 days left,Help get Lovelace Atelier open after COVID-19!,,April Lovelace in,"Southsea, England, United Kingdom","1,310",1310,"raised of £4,000 target",4000,"4,000",26,supporters,32%,23 days left,Business,,,,
https://www.crowdfunder.co.uk/llety-cynin-pay-it-forward,Pay It Forward ,Pay It Forward - Spa Hotel & Restaurant - a Business crowdfunding project in St. Clears by Gwawr Davies,27 days left,Pay It Forward - Spa Hotel & Restaurant,,Gwawr Davies in,"St. Clears, Wales, United Kingdom","1,304",1304,"raised of £4,000 target",4000,"4,000",21,supporters,32%,27 days left,Business,,,,
https://www.crowdfunder.co.uk/supersprogs-1,Supersprogs ,Supersprogs - unmumsy nursing clothes - a Social Enterprise crowdfunding project in Ivinghoe by Daisy Fretwell,2020-03-03T15:10:00+00:00,Supersprogs - unmumsy nursing clothes,2020-03-03T15:10:00+00:00,Daisy Fretwell in,"Ivinghoe, England, United Kingdom","1,298",1298,"raised of £5,000 target",5000,"5,000",17,supporters,25%,8 days left,Social Enterprise,,,,
https://www.crowdfunder.co.uk/pledge-a-pint-lyme-regis-brewery-during-covid-19,Pledge-a-Pint @ Lyme Regis Brewery during COVID-19 ,Pledge-a-Pint @ Lyme Regis Brewery during COVID-19 - a Business crowdfunding project in Lyme Regis by Lyme Regis Brewery,8 days left,Pledge-a-Pint @ Lyme Regis Brewery during COVID-19,,Lyme Regis Brewery in,"Lyme Regis, England, United Kingdom","1,295",1295,"raised of £10,000 target",10000,"10,000",35,supporters,12%,8 days left,Business,,,,
https://www.crowdfunder.co.uk/stockportmind,Digital mental health support (Coronavirus update) ,Digital mental health support (Coronavirus update) - a Community crowdfunding project in Stockport by Marcus from Stockport Mind,2020-03-03T23:59:59+00:00,Digital mental health support (Coronavirus update),2020-03-03T23:59:59+00:00,Marcus from Stockport Mind in,"Stockport, England, United Kingdom","1,294",1294,"raised of £6,550 target",6550,"6,550",38,supporters,19%,84 days left,Community,,,,
https://www.crowdfunder.co.uk/connecting-families-in-the-covid-19-crisis,Connecting families in the COVID-19 crisis ,Connecting families in the COVID-19 crisis - a Community crowdfunding project in Alloa by John Nicolson MP,8 days left,Connecting families in the COVID-19 crisis,,John Nicolson MP in,"Alloa, Scotland, United Kingdom","1,290",1290,"raised of £5,000 target",5000,"5,000",66,supporters,25%,8 days left,Community,,,,
https://www.crowdfunder.co.uk/newforestshortbread-buy-forward,Buy Forward... Boxes of New Forest Shortbread ,Buy Forward... Boxes of New Forest Shortbread - a Business crowdfunding project in Burley by Tracy Thew,2020-04-19T14:11:54+01:00,Buy Forward... Boxes of New Forest Shortbread,2020-04-19T14:11:54+01:00,Tracy Thew in,"Burley, England, United Kingdom","1,289",1289,"raised of £4,500 target",4500,"4,500",32,supporters,28%,25 days left,Business,,,,
https://www.crowdfunder.co.uk/help-us-save-ai-normanni---celebrate-italian-food,Help us save Ai Normanni ,Help us save Ai Normanni - Celebrate Italian food - a Business crowdfunding project in Palermo by GIANMARCO TROIA,28 days left,Help us save Ai Normanni - Celebrate Italian food,,GIANMARCO TROIA in,"Palermo, Provincia di Palermo, Italy","1,285",1285,"raised of £15,000 target",15000,"15,000",25,supporters,8%,28 days left,Business,,,,
https://www.crowdfunder.co.uk/heat-the-hut,"Heat the Hut, to add heaters to the building ","Heat the Hut, to add heaters to the building - a Community crowdfunding project in Totton by Donna Ovenden",84 days left,"Heat the Hut, to add heaters to the building",,Donna Ovenden in,"Totton, England, United Kingdom","1,283",1283,"raised of £3,000 target",3000,"3,000",14,supporters,42%,84 days left,Community,,,,
https://www.crowdfunder.co.uk/macbi-extension-project-crowd-funding,Macbi Extension Project ,Macbi Extension Project - a Community crowdfunding project in Mintlaw by Connie Strachan,84 days left,Macbi Extension Project,,Connie Strachan in,"Mintlaw, Scotland, United Kingdom","1,280",1280,"raised of £20,000 target",20000,"20,000",68,supporters,6%,84 days left,Community,,,,
https://www.crowdfunder.co.uk/miicare,AI Home Health Companions for Quarantined Elderly ,AI Home Health Companions for Quarantined Elderly - a Business crowdfunding project in London by Ophir Levy,2020-04-08T00:04:02+01:00,AI Home Health Companions for Quarantined Elderly,2020-04-08T00:04:02+01:00,Ophir Levy in,"London, England, United Kingdom","1,270",1270,"raised of £25,000 target",25000,"25,000",12,supporters,5%,13 days left,Business,,,,
https://www.crowdfunder.co.uk/keepthemsafesurrey,Keep Them Safe #Surrey ,Keep Them Safe #Surrey - a Community crowdfunding project in Effingham by Louise Hallam,13 days left,Keep Them Safe #Surrey,,Louise Hallam in,"Effingham, England, United Kingdom","1,255",1255,"raised of £4,000 target",4000,"4,000",26,supporters,31%,13 days left,Community,,,,
https://www.crowdfunder.co.uk/help-to-keep-zebras-open-after-the-covid-19-crisis,Help to keep Zebras open after the Covid 19 crisis ,Help to keep Zebras open after the Covid 19 crisis - a Community crowdfunding project in Bristol by Zebras Out of School Club,7 days left,Help to keep Zebras open after the Covid 19 crisis,,Zebras Out of School Club in,"Bristol, England, United Kingdom","1,250",1250,"raised of £5,000 target",5000,"5,000",23,supporters,25%,7 days left,Community,,,,
https://www.crowdfunder.co.uk/ingrown-hair-out---enjoy-the-feeling,Ingrown Out ,Ingrown Out - Enjoy the feeling - a Business crowdfunding project in Birmingham by Ingrown out - Enjoy the feeling,2020-04-10T14:13:02+01:00,Ingrown Out - Enjoy the feeling,2020-04-10T14:13:02+01:00,Ingrown out - Enjoy the feeling in,"Birmingham, England, United Kingdom","1,250",1250,"raised of £10,000 target",10000,"10,000",10,supporters,12%,44 days left,Business,,,,
https://www.crowdfunder.co.uk/spotlight-on-stage-left-at-the-palace-theatre,Spotlight on 'Stage Left' at the Palace Theatre ,Spotlight on 'Stage Left' at the Palace Theatre - a Music crowdfunding project in Paignton by Maureen McAllister,2020-03-07T13:54:00+00:00,Spotlight on 'Stage Left' at the Palace Theatre,2020-03-07T13:54:00+00:00,Maureen McAllister in,"Paignton, England, United Kingdom","1,250",1250,"raised of £30,000 target",30000,"30,000",24,supporters,4%,100 days left,Music,,,,
https://www.crowdfunder.co.uk/catering-equipment-to-launch-hot-food-delivery,Catering equipment to launch vegan food delivery ,Catering equipment to launch vegan food delivery - a Food and Drink crowdfunding project in Warrington by Lynda Price,6 days left,Catering equipment to launch vegan food delivery,,Lynda Price in,"Warrington, England, United Kingdom","1,245",1245,"raised of £6,000 target",6000,"6,000",24,supporters,20%,6 days left,Food and Drink,,,,
https://www.crowdfunder.co.uk/building-a-house-for-a-poor-family-in-bangladesh,Build a house for a poor family in Bangladadesh ,Build a house for a poor family in Bangladadesh - a Charities crowdfunding project in London by Tayef Uddin,12 days left,Build a house for a poor family in Bangladadesh,,Tayef Uddin in,"London, England, United Kingdom","1,240",1240,"raised of £3,000 target",3000,"3,000",41,supporters,41%,12 days left,Charities,,,,
https://www.crowdfunder.co.uk/we-can-do-anything,We Can Do Anything ,We Can Do Anything - a Charities crowdfunding project in Woking by LinkAble,2020-03-03T23:59:59+00:00,We Can Do Anything,2020-03-03T23:59:59+00:00,LinkAble in,"Woking, England, United Kingdom","1,219",1219,"raised of £3,500 target",3500,"3,500",4,supporters,34%,84 days left,Charities,,,,
https://www.crowdfunder.co.uk/bella-noemi-events-1,Bella Noemi Events ,Bella Noemi Events - a Arts crowdfunding project in London by Tracie Vivian,2020-03-03T13:00:00+00:00,Bella Noemi Events,2020-03-03T13:00:00+00:00,Tracie Vivian in,"London, England, United Kingdom","1,215",1215,"raised of £2,500 stretch target",2500,"2,500 stretch",,supporters,49%,8 days left,Arts,,,,
https://www.crowdfunder.co.uk/1st-chertsey-scout-group,New Equipment for 1st Chertsey Scout Group HQ ,New Equipment for 1st Chertsey Scout Group HQ - a Community crowdfunding project in Chertsey by Brian Frank Perry,2019-11-19T00:00:00+00:00,New Equipment for 1st Chertsey Scout Group HQ,2019-11-19T00:00:00+00:00,Brian Frank Perry in,"Chertsey, England, United Kingdom","1,215",1215,"raised of £2,500 target",2500,"2,500",5,supporters,48%,26 days left,Community,,,,
https://www.crowdfunder.co.uk/happyfridaykitchen,Happy Friday Kitchen ,Happy Friday Kitchen - Buddha’s Treat Fund - a Business crowdfunding project in Oxford by Lola Dixon,27 days left,Happy Friday Kitchen - Buddha’s Treat Fund,,Lola Dixon in,"Oxford, England, United Kingdom","1,210",1210,"raised of £15,000 target",15000,"15,000",38,supporters,8%,27 days left,Business,,,,
https://www.crowdfunder.co.uk/art-residencies-with-indigenous-communities,"Sensoring sound, Mapping the Invisible ","Sensoring sound, Mapping the Invisible - a Community crowdfunding project in Panama by Bert Gilbert",8 days left,"Sensoring sound, Mapping the Invisible",,Bert Gilbert in,Panama,"1,202",1202,"raised of £5,450 target",5450,"5,450",21,supporters,22%,8 days left,Community,,,,
https://www.crowdfunder.co.uk/football-fans-v-coronavirus,Football Fans v Coronavirus ,Football Fans v Coronavirus - a Community crowdfunding project in Liverpool by Rainbow Man,4 days left,Football Fans v Coronavirus,,Rainbow Man in,"Liverpool, England, United Kingdom","1,200",1200,"raised of £2,000 stretch target",2000,"2,000 stretch",,supporters,60%,4 days left,Community,,,,
https://www.crowdfunder.co.uk/stript-cosmetics-plastic-free,Stript Cosmetics' Plastic-free Make-Up Campaign ,Stript Cosmetics' Plastic-free Make-Up Campaign - a Environment crowdfunding project in Walsall by Becky Shuck,2020-03-03T13:00:00+00:00,Stript Cosmetics' Plastic-free Make-Up Campaign,2020-03-03T13:00:00+00:00,Becky Shuck in,"Walsall, England, United Kingdom","1,200",1200,"raised of £2,000 target",2000,"2,000",40,supporters,60%,8 days left,Environment,,,,
https://www.crowdfunder.co.uk/support-howling-wolf-coffee-through-covid-19,Support Howling Wolf Coffee through COVID-19 ,Support Howling Wolf Coffee through COVID-19 - a Business crowdfunding project in Colyford by Howling Wolf Coffee,2020-03-25T11:29:03+00:00,Support Howling Wolf Coffee through COVID-19,2020-03-25T11:29:03+00:00,Howling Wolf Coffee in,"Colyford, England, United Kingdom","1,200",1200,"raised of £10,000 target",10000,"10,000",55,supporters,12%,28 days left,Business,,,,
https://www.crowdfunder.co.uk/stepup4ournhsheroes-challenge,#StepUp4OurNHS ,#StepUp4OurNHS - a crowdfunding project in United Kingdom by Food4Heroes,16 days left,#StepUp4OurNHS,,,,"1,195",1195,"raised of £100,000 target",100000,"100,000",49,supporters,1%,16 days left,Charities,,,,
https://www.crowdfunder.co.uk/snapssuperherozoom,SNAPS Superhero Zoom ,SNAPS Superhero Zoom - a Community crowdfunding project in Leeds by Jenny Sellers,2020-03-03T23:59:59+00:00,SNAPS Superhero Zoom,2020-03-03T23:59:59+00:00,Jenny Sellers in,"Leeds, England, United Kingdom","1,193",1193,"raised of £2,000 target",2000,"2,000",11,supporters,59%,84 days left,Community,,,,
https://www.crowdfunder.co.uk/saving-lives-together,Helping improve OOH cardiac arrest survival rates ,Helping improve OOH cardiac arrest survival rates - a Community crowdfunding project in Exeter by Zoe Larter,84 days left,Helping improve OOH cardiac arrest survival rates,,Zoe Larter in,"Exeter, England, United Kingdom","1,193",1193,"raised of £12,000 target",12000,"12,000",11,supporters,9%,84 days left,Community,,,,
https://www.crowdfunder.co.uk/support-viva-blackpool-through-covid-19,Support the Viva Blackpool team through Covid-19 ,Support the Viva Blackpool team through Covid-19 - a Business crowdfunding project in Blackpool by Viva Blackpool,2020-04-01T15:01:32+01:00,Support the Viva Blackpool team through Covid-19,2020-04-01T15:01:32+01:00,Viva Blackpool in,"Blackpool, England, United Kingdom","1,191",1191,"raised of £12,000 target",12000,"12,000",29,supporters,9%,7 days left,Business,,,,
https://www.crowdfunder.co.uk/bracknell-foodbank-covid19-crisis-appeal,Bracknell Foodbank ,Bracknell Foodbank - Covid19 Crisis Appeal - a Community crowdfunding project in Bracknell by Bracknell Foodbank,9 days left,Bracknell Foodbank - Covid19 Crisis Appeal,,Bracknell Foodbank in,"Bracknell, England, United Kingdom","1,190",1190,"raised of £5,000 target",5000,"5,000",33,supporters,23%,9 days left,Community,,,,
https://www.crowdfunder.co.uk/the-lift-up-cafe-covid-19-survival-fund,The Lift Up Cafe Covid-19 Survival Fund ,The Lift Up Cafe Covid-19 Survival Fund - a Food and Drink crowdfunding project in Urmston by Sian Marie Evans,18 days left,The Lift Up Cafe Covid-19 Survival Fund,,Sian Marie Evans in,"Urmston, England, United Kingdom","1,190",1190,"raised of £10,000 target",10000,"10,000",44,supporters,11%,18 days left,Food and Drink,,,,
https://www.crowdfunder.co.uk/paignton-geoplay-park,Paignton Geoplay Park ,Paignton Geoplay Park - a Community crowdfunding project in Paignton by Paignton Community Partnership,16 days left,Paignton Geoplay Park,,Paignton Community Partnership in,"Paignton, England, United Kingdom","1,190",1190,"raised of £40,000 target",40000,"40,000",34,supporters,2%,16 days left,Community,,,,
https://www.crowdfunder.co.uk/snitterfield-scrubbers,Snitterfield Scrubbers ,Snitterfield Scrubbers - a Community crowdfunding project in Snitterfield by Snitterfield Village,3 days left,Snitterfield Scrubbers,,Snitterfield Village in,"Snitterfield, England, United Kingdom","1,185",1185,"raised of £1,250 target",1250,"1,250",38,supporters,94%,3 days left,Community,,,,
https://www.crowdfunder.co.uk/rwanda2020,Let's Build a Library ,Let's Build a Library - SMESU Rwanda 2020 - a Charities crowdfunding project in Edinburgh by SMESU Rwanda 2020,2020-03-04T22:31:15+00:00,Let's Build a Library - SMESU Rwanda 2020,2020-03-04T22:31:15+00:00,SMESU Rwanda 2020 in,"Edinburgh, Scotland, United Kingdom","1,180",1180,"raised of £7,500 target",7500,"7,500",33,supporters,15%,7 days left,Charities,,,,
https://www.crowdfunder.co.uk/the-borough-free-fridge---covid-19-support-project,The Borough Free Fridge ,The Borough Free Fridge - COVID-19 Support Project - a Food and Drink crowdfunding project in London by The Borough Free Fridge,23 days left,The Borough Free Fridge - COVID-19 Support Project,,The Borough Free Fridge in,"London, England, United Kingdom","1,175",1175,"raised of £2,000 target",2000,"2,000",16,supporters,58%,23 days left,Food and Drink,,,,
https://www.crowdfunder.co.uk/save-the-hourglass-newspaper-a-new-model-of-media,Save The Hourglass newspaper: a new model of media ,Save The Hourglass newspaper: a new model of media - a Charities crowdfunding project in Exeter by Z Lights,10 days left,Save The Hourglass newspaper: a new model of media,,Z Lights in,"Exeter, England, United Kingdom","1,172",1172,"raised of £3,200 target",3200,"3,200",44,supporters,36%,10 days left,Charities,,,,
https://www.crowdfunder.co.uk/help-disabled-adults-in-birmingham-through-covid19,Help disabled adults in Birmingham through Covid19 ,Help disabled adults in Birmingham through Covid19 - a Community crowdfunding project in Moseley by NICE Charity,2020-04-03T13:42:37+01:00,Help disabled adults in Birmingham through Covid19,2020-04-03T13:42:37+01:00,NICE Charity in,"Moseley, England, United Kingdom","1,156",1156,"raised of £25,120 target",25120,"25,120",56,supporters,4%,16 days left,Community,,,,
https://www.crowdfunder.co.uk/kingfisher-foodbank,Kingfisher Foodbank ,Kingfisher Foodbank - a Business crowdfunding project in Birmingham by Kingfisher Foodbank,42 days left,Kingfisher Foodbank,,Kingfisher Foodbank in,"Birmingham, England, United Kingdom","1,150",1150,"raised of £5,000 target",5000,"5,000",33,supporters,23%,42 days left,Business,,,,
https://www.crowdfunder.co.uk/doncaster-foodbank-covid19-crisis-appeal,Doncaster Foodbank ,Doncaster Foodbank - Covid19 Crisis Appeal - a Community crowdfunding project in Doncaster by Doncaster Foodbank,31 days left,Doncaster Foodbank - Covid19 Crisis Appeal,,Doncaster Foodbank in,"Doncaster, England, United Kingdom","1,148",1148,"raised of £5,000 target",5000,"5,000",27,supporters,22%,31 days left,Community,,,,
https://www.crowdfunder.co.uk/bridportcommunityhospital,Covid-19 Appeal for NHS staff at Bridport Hospital ,Covid-19 Appeal for NHS staff at Bridport Hospital - a Social Enterprise crowdfunding project in Bridport by Amy Gibbs,22 days left,Covid-19 Appeal for NHS staff at Bridport Hospital,,Amy Gibbs in,"Bridport, England, United Kingdom","1,145",1145,"raised of £3,000 target",3000,"3,000",65,supporters,38%,22 days left,Social Enterprise,,,,
https://www.crowdfunder.co.uk/save-cmc-adventure-enrich-real-lives,Help save CMC Adventure and enrich real lives! ,Help save CMC Adventure and enrich real lives! - a Charities crowdfunding project in Llanbedr by CMC Adventure,2020-04-17T12:17:07+01:00,Help save CMC Adventure and enrich real lives!,2020-04-17T12:17:07+01:00,CMC Adventure in,"Llanbedr, Wales, United Kingdom","1,140",1140,"raised of £24,000 target",24000,"24,000",25,supporters,4%,23 days left,Charities,,,,
https://www.crowdfunder.co.uk/sunnyhillceramics-1,Sunnyhill Ceramics ,Sunnyhill Ceramics - a Arts crowdfunding project in Dumfries by Heather Dorman,5 days left,Sunnyhill Ceramics,,Heather Dorman in,"Dumfries, Scotland, United Kingdom","1,135",1135,"raised of £2,500 stretch target",2500,"2,500 stretch",,supporters,45%,5 days left,Arts,,,,
https://www.crowdfunder.co.uk/give-waves,Give a Wave to NHS & Emergency Workers ,Give a Wave to NHS & Emergency Workers - a Business crowdfunding project in Whitley Bay by CBK's Adventure Co.,23 days left,Give a Wave to NHS & Emergency Workers,,CBK's Adventure Co. in,"Whitley Bay, England, United Kingdom","1,135",1135,"raised of £3,000 target",3000,"3,000",22,supporters,37%,23 days left,Business,,,,
https://www.crowdfunder.co.uk/the-quiet-space,The Quiet Space | Accessible Counselling Service ,The Quiet Space | Accessible Counselling Service - a Community crowdfunding project in Glasgow by Trudi Donahue,2020-03-03T23:59:59+00:00,The Quiet Space | Accessible Counselling Service,2020-03-03T23:59:59+00:00,Trudi Donahue in,"Glasgow, Scotland, United Kingdom","1,130",1130,"raised of £3,000 target",3000,"3,000",20,supporters,37%,84 days left,Community,,,,
https://www.crowdfunder.co.uk/corona-virus-emergency-fund,Corona Virus Crisis Fund ,Corona Virus Crisis Fund - a Community crowdfunding project in London by New Era Fund,2020-04-08T19:24:00+01:00,Corona Virus Crisis Fund,2020-04-08T19:24:00+01:00,New Era Fund in,"London, England, United Kingdom","1,130",1130,"raised of £250,000 target",250000,"250,000",28,supporters,0%,7 days left,Community,,,,
https://www.crowdfunder.co.uk/social-enterprise-marketplace,Social Enterprise Marketplace ,Social Enterprise Marketplace - a Social Enterprise crowdfunding project in Winchester by john merritt,37 days left,Social Enterprise Marketplace,,john merritt in,"Winchester, England, United Kingdom","1,125",1125,"raised of £6,500 target",6500,"6,500",9,supporters,17%,37 days left,Social Enterprise,,,,
https://www.crowdfunder.co.uk/thecottageinn,Help The Cottage Inn Survive COVID-19! ,Help The Cottage Inn Survive COVID-19! - a Business crowdfunding project in Dunstan by Help The Cottage Inn!!!,6 days left,Help The Cottage Inn Survive COVID-19!,,Help The Cottage Inn!!! in,"Dunstan, England, United Kingdom","1,125",1125,"raised of £10,000 target",10000,"10,000",20,supporters,11%,6 days left,Business,,,,
https://www.crowdfunder.co.uk/angel-school-ponies,Angel School Ponies ,Angel School Ponies - a Business crowdfunding project in Gateforth by Joanne Small,34 days left,Angel School Ponies,,Joanne Small in,"Gateforth, England, United Kingdom","1,111",1111,"raised of £1,000 target",1000,"1,000",43,supporters,111%,34 days left,Business,,,,
https://www.crowdfunder.co.uk/theliquidweapon,The Liquid Weapon ,The Liquid Weapon - a Charities crowdfunding project in Dorchester by Ellie Smeaton,8 days left,The Liquid Weapon,,Ellie Smeaton in,"Dorchester, England, United Kingdom","1,110",1110,"raised of £1,500 target",1500,"1,500",34,supporters,74%,8 days left,Charities,,,,
https://www.crowdfunder.co.uk/the-sunflower-lounge-vs-covid-19,The Sunflower Lounge vs COVID-19 ,The Sunflower Lounge vs COVID-19 - a Business crowdfunding project in Birmingham by Sunflower Lounge,41 days left,The Sunflower Lounge vs COVID-19,,Sunflower Lounge in,"Birmingham, England, United Kingdom","1,106",1106,"raised of £5,000 target",5000,"5,000",74,supporters,22%,41 days left,Business,,,,
https://www.crowdfunder.co.uk/big-sis-girl-to-girl-mentoring,Girl mental health mentoring Covid-19 ,Girl mental health mentoring Covid-19 - a Schools crowdfunding project in Plymouth by Big Sis CIC,2020-03-15T17:05:00+00:00,Girl mental health mentoring Covid-19,2020-03-15T17:05:00+00:00,Big Sis CIC in,"Plymouth, England, United Kingdom","1,106",1106,"raised of £15,000 target",15000,"15,000",64,supporters,7%,19 days left,Schools,,,,
https://www.crowdfunder.co.uk/confessions-of-an-ageing-tennis-player,Confessions of an Ageing Tennis Player ,Confessions of an Ageing Tennis Player - a Publishing crowdfunding project in Nottingham by Nick Owen,2020-02-09T11:10:00+00:00,Confessions of an Ageing Tennis Player,2020-02-09T11:10:00+00:00,Nick Owen in,"Nottingham, England, United Kingdom","1,102",1102,"raised of £4,713 target",4713,"4,713",42,supporters,23%,24 days left,Publishing,,,,
