URL,Headingonly,Title,DATE INDICATOR,Heading,Created,By,Location,Raised,raised as number,raised as words,target as number,Oftarget,Supporters,Supporters/investors,Timeleft 3,Timeleft 4,Category,Heading 2,Heading 3,Raisedby,Startedon
https://www.crowdfunder.co.uk/bwrbackontrack,Help us get back on track ,Help us get back on track - a Business crowdfunding project in Bodmin by Bodmin & Wenford Railway,35 days left,Help us get back on track,,Bodmin & Wenford Railway in,"Bodmin, England, United Kingdom","3,567",3567,"raised of £30,000 target",30000,"30,000",88,supporters,11%,35 days left,Business,,,,
https://www.crowdfunder.co.uk/british-ice-skating-coach-crisis-fund,British Ice Skating ,British Ice Skating - Coach Crisis Fund - a Sports crowdfunding project in Sheffield by Andrew Hibberd,1 day left,British Ice Skating - Coach Crisis Fund,,Andrew Hibberd in,"Sheffield, England, United Kingdom","3,560",3560,"raised of £15,000 target",15000,"15,000",62,supporters,23%,1 day left,Sports,,,,
https://www.crowdfunder.co.uk/cheam-cc-covid-19-emergency-appeal,Cheam CC COVID-19 Emergency Appeal ,Cheam CC COVID-19 Emergency Appeal - a Community crowdfunding project in Sutton by Cheam Cricket Club,2 days left,Cheam CC COVID-19 Emergency Appeal,,Cheam Cricket Club in,"Sutton, England, United Kingdom","3,530",3530,"raised of £5,000 target",5000,"5,000",34,supporters,70%,2 days left,Community,,,,
https://www.crowdfunder.co.uk/ngyt-corona-virus-impact-fund,NGYT and Local Artist Coronavirus Impact Fund ,NGYT and Local Artist Coronavirus Impact Fund - a Community crowdfunding project in Luton by Next Generation Youth Theatre,2020-03-27T20:43:00+00:00,NGYT and Local Artist Coronavirus Impact Fund,2020-03-27T20:43:00+00:00,Next Generation Youth Theatre in,"Luton, England, United Kingdom","3,530",3530,"raised of £5,000 target",5000,"5,000",84,supporters,70%,8 days left,Community,,,,
https://www.crowdfunder.co.uk/canine-rehabilitation-centre-kent,Canine Hydro & Rehabilitation Centre in Kent ,Canine Hydro & Rehabilitation Centre in Kent - a Sports crowdfunding project in Manston by Laura Hackett,2020-03-03T13:00:00+00:00,Canine Hydro & Rehabilitation Centre in Kent,2020-03-03T13:00:00+00:00,Laura Hackett in,"Manston, England, United Kingdom","3,516",3516,"raised of £5,000 stretch target",5000,"5,000 stretch",,supporters,70%,8 days left,Sports,,,,
https://www.crowdfunder.co.uk/help-musicians-survive-covid-19,Help musicians survive COVID-19 ,Help musicians survive COVID-19 - a Food and Drink crowdfunding project in Les Allues by Jacks,2020-04-08T11:25:30+01:00,Help musicians survive COVID-19,2020-04-08T11:25:30+01:00,Jacks in,"Les Allues, Savoie, France","3,510",3510,"raised of £5,000 target",5000,"5,000",63,supporters,70%,14 days left,Food and Drink,,,,
https://www.crowdfunder.co.uk/winchradio,New Accessible Studios ,New Accessible Studios - a Community crowdfunding project in Winchester by Winchester Radio,26 days left,New Accessible Studios,,Winchester Radio in,"Winchester, England, United Kingdom","3,462",3462,"raised of £5,000 target",5000,"5,000",27,supporters,69%,26 days left,Community,,,,
https://www.crowdfunder.co.uk/covid19airwaymedicalsuctionunit,Covid-19 / Coronavirus Emergency Medical Suction ,Covid-19 / Coronavirus Emergency Medical Suction - a Business crowdfunding project in Bristol by Covid19 Free Devices to NHS,2020-04-14T11:00:00+01:00,Covid-19 / Coronavirus Emergency Medical Suction,2020-04-14T11:00:00+01:00,Covid19 Free Devices to NHS in,"Bristol, England, United Kingdom","3,455",3455,"raised of £10,000 target",10000,"10,000",68,supporters,34%,19 days left,Business,,,,
https://www.crowdfunder.co.uk/operation-snap-enterprise,OperationSNAP Enterprise for learning disabilities ,OperationSNAP Enterprise for learning disabilities - a Charities crowdfunding project in Walnut Tree by MK SNAP,2019-11-19T00:00:00+00:00,OperationSNAP Enterprise for learning disabilities,2019-11-19T00:00:00+00:00,MK SNAP in,"Walnut Tree, England, United Kingdom","3,434",3434,"raised of £5,000 target",5000,"5,000",45,supporters,68%,26 days left,Charities,,,,
https://www.crowdfunder.co.uk/support-sittingbourne-fc-and-the-nhs-1,Support Sittingbourne FC and the NHS ,Support Sittingbourne FC and the NHS - a Sports crowdfunding project in Sittingbourne by Andrew Marjeram,13 days left,Support Sittingbourne FC and the NHS,,,,"3,418",3418,"raised of £5,000 target",5000,"5,000",62,supporters,68%,13 days left,Sports,Support Sittingbourne FC and the NHS,,,
https://www.crowdfunder.co.uk/keelhamplaygroundredevelopment,Playground resurface and new equipment ,Playground resurface and new equipment - a Community crowdfunding project in Thornton by Keelham Parents Association,2019-11-19T00:00:00+00:00,Playground resurface and new equipment,2019-11-19T00:00:00+00:00,Keelham Parents Association in,"Thornton, England, United Kingdom","3,400",3400,"raised of £3,401 stretch target",3401,"3,401 stretch",,supporters,100%,26 days left,Community,,,,
https://www.crowdfunder.co.uk/needed-now-more-than-ever,Needed Now More Than Ever ,Needed Now More Than Ever - a Business crowdfunding project in Norwich by Rebecca White,2020-03-30T12:00:04+01:00,Needed Now More Than Ever,2020-03-30T12:00:04+01:00,Rebecca White in,"Norwich, England, United Kingdom","3,390",3390,"raised of £10,000 target",10000,"10,000",87,supporters,33%,5 days left,Business,,,,
https://www.crowdfunder.co.uk/nicol-denoir-bespoke-corsetry-fashion-label,Nicol DeNoir™ bespoke corsetry fashion label ,Nicol DeNoir™ bespoke corsetry fashion label - a Arts crowdfunding project in London by Nicol DeNoir,2020-03-03T17:18:00+00:00,Nicol DeNoir™ bespoke corsetry fashion label,2020-03-03T17:18:00+00:00,Nicol DeNoir in,"London, England, United Kingdom","3,385",3385,"raised of £5,000 target",5000,"5,000",46,supporters,67%,8 days left,Arts,,,,
https://www.crowdfunder.co.uk/emergency-support-for-developing-world-seafarers,Emergency Funding for Developing World Seafarers ,Emergency Funding for Developing World Seafarers - a Community crowdfunding project in London by Gavin Allwright,11 days left,Emergency Funding for Developing World Seafarers,,Gavin Allwright in,"London, England, United Kingdom","3,315",3315,"raised of £25,000 target",25000,"25,000",88,supporters,13%,11 days left,Community,,,,
https://www.crowdfunder.co.uk/donatetoprotectnhsworkers,Donate to #ProtectNHSworkers ,Donate to #ProtectNHSworkers - a Charities crowdfunding project in London by NHS Support Fund,8 days left,Donate to #ProtectNHSworkers,,NHS Support Fund in,"London, England, United Kingdom","3,307",3307,"raised of £200,000 target",200000,"200,000",115,supporters,1%,8 days left,Charities,,,,
https://www.crowdfunder.co.uk/sewing-scrubs-for-st-helens-and-knowsley-nhs,Sewing Scrubs for St Helens and Knowsley NHS ,Sewing Scrubs for St Helens and Knowsley NHS - a Community crowdfunding project in Widnes by Threadication Scubs for NHS,16 days left,Sewing Scrubs for St Helens and Knowsley NHS,,Threadication Scubs for NHS in,"Widnes, England, United Kingdom","3,305",3305,"raised of £5,000 stretch target",5000,"5,000 stretch",,supporters,66%,16 days left,Community,,,,
https://www.crowdfunder.co.uk/help-feed-the-horses-at-the-holistic-horse-pony,Help Feed the horses at the Holistic Horse & Pony ,Help Feed the horses at the Holistic Horse & Pony - a Business crowdfunding project in Ockham by Wendy Firmin-Price,2020-04-02T14:18:17+01:00,Help Feed the horses at the Holistic Horse & Pony,2020-04-02T14:18:17+01:00,Wendy Firmin-Price in,"Ockham, England, United Kingdom","3,275",3275,"raised of £5,000 target",5000,"5,000",46,supporters,65%,36 days left,Business,,,,
https://www.crowdfunder.co.uk/help-showcase-the-street-survive-1,Help Showcase the Street survive COVID-19 crisis ,Help Showcase the Street survive COVID-19 crisis - a Charities crowdfunding project in Dundee by Showcase the Street,18 days left,Help Showcase the Street survive COVID-19 crisis,,Showcase the Street in,"Dundee, Scotland, United Kingdom","3,270",3270,"raised of £25,000 target",25000,"25,000",59,supporters,13%,18 days left,Charities,,,,
https://www.crowdfunder.co.uk/keeping-alive,Keeping Alive ,Keeping Alive - a Arts crowdfunding project in Witham by Witham Public Hall,18 days left,Keeping Alive,,Witham Public Hall in,"Witham, England, United Kingdom","3,260",3260,"raised of £10,000 target",10000,"10,000",106,supporters,32%,18 days left,Arts,,,,
https://www.crowdfunder.co.uk/buy-a-brick-for-the-uk-disabled-animal-centre,Buy-A-Brick for our UK Disabled Animal Centre ,Buy-A-Brick for our UK Disabled Animal Centre - a Charities crowdfunding project in Carlisle by Miracle's Mission,7 hours left,Buy-A-Brick for our UK Disabled Animal Centre,,Miracle's Mission in,"Carlisle, England, United Kingdom","3,233",3233,"raised of £3,000 target",3000,"3,000",185,supporters,107%,7 hours left,Charities,,,,
https://www.crowdfunder.co.uk/covid-19-response,Covid-19 Response ,Covid-19 Response - a Charities crowdfunding project in Welwyn Garden City by The Jubilee House Care Trust Ltd,2020-04-08T18:37:41+01:00,Covid-19 Response,2020-04-08T18:37:41+01:00,The Jubilee House Care Trust Ltd in,"Welwyn Garden City, England, United Kingdom","3,215",3215,"raised of £7,000 target",7000,"7,000",96,supporters,45%,14 days left,Charities,,,,
https://www.crowdfunder.co.uk/emergency-appeal-for-chefs-in-schools,Emergency appeal for Chefs in Schools ,Emergency appeal for Chefs in Schools - a Charities crowdfunding project in London by Chefs in Schools,7 days left,Emergency appeal for Chefs in Schools,,Chefs in Schools in,"London, England, United Kingdom","3,210",3210,"raised of £20,000 target",20000,"20,000",57,supporters,16%,7 days left,Charities,,,,
https://www.crowdfunder.co.uk/wwwsikhwelfarecouk,VOICE! ,VOICE! - a Sports crowdfunding project in Slough by Sukh Singh,2020-03-03T23:59:59+00:00,VOICE!,2020-03-03T23:59:59+00:00,Sukh Singh in,"Slough, England, United Kingdom","3,205",3205,"raised of £5,000 target",5000,"5,000",33,supporters,64%,84 days left,Sports,,,,
https://www.crowdfunder.co.uk/drummers-call,Drummers Call by Methil and District Pipe Band ,Drummers Call by Methil and District Pipe Band - a Music crowdfunding project in Buckhaven by Methil and District Pipe Band,2020-03-08T10:46:00+00:00,Drummers Call by Methil and District Pipe Band,2020-03-08T10:46:00+00:00,Methil and District Pipe Band in,"Buckhaven, Scotland, United Kingdom","3,199",3199,"raised of £4,000 stretch target",4000,"4,000 stretch",,supporters,80%,10 days left,Music,,,,
https://www.crowdfunder.co.uk/dementia-apartments,Living well with dementia ,Living well with dementia - Let's get outdoors! - a Charities crowdfunding project in York by Caroline Newnham,84 days left,Living well with dementia - Let's get outdoors!,,Caroline Newnham in,"York, England, United Kingdom","3,183",3183,"raised of £5,000 target",5000,"5,000",31,supporters,63%,84 days left,Charities,,,,
https://www.crowdfunder.co.uk/govanhill-food-pantry,Govanhill Community Food Pantry ,Govanhill Community Food Pantry - a Food and Drink crowdfunding project in Glasgow by Govanhill Baths Community Trust,26 days left,Govanhill Community Food Pantry,,Govanhill Baths Community Trust in,"Glasgow, Scotland, United Kingdom","3,180",3180,"raised of £10,000 stretch target",10000,"10,000 stretch",,supporters,32%,26 days left,Food and Drink,,,,
https://www.crowdfunder.co.uk/keep-oxon-reading,Keep OxOn Reading ,Keep OxOn Reading - a Charities crowdfunding project in Didcot by Sian Renwick,20 days left,Keep OxOn Reading,,Sian Renwick in,"Didcot, England, United Kingdom","3,140",3140,"raised of £5,000 target",5000,"5,000",68,supporters,62%,20 days left,Charities,,,,
https://www.crowdfunder.co.uk/support-love-open-water,Support Love Open Water Venues During Closure ,Support Love Open Water Venues During Closure - a Business crowdfunding project in London by Love open water,42 days left,Support Love Open Water Venues During Closure,,Love open water in,"London, England, United Kingdom","3,087",3087,"raised of £24,000 target",24000,"24,000",84,supporters,12%,42 days left,Business,,,,
https://www.crowdfunder.co.uk/helping-the-georgian-theatre-stockton-on-tees,"Help The Georgian Theatre, Stockton-on-Tees ","Help The Georgian Theatre, Stockton-on-Tees - a Music crowdfunding project in Stockton On Tees by The Georgian Theatre, Stockton",2020-03-26T18:40:00+00:00,"Help The Georgian Theatre, Stockton-on-Tees",2020-03-26T18:40:00+00:00,"The Georgian Theatre, Stockton in","Stockton On Tees, England, United Kingdom","3,085",3085,"raised of £25,000 target",25000,"25,000",119,supporters,12%,29 days left,Music,,,,
https://www.crowdfunder.co.uk/building-an-organic-community-farm-in-east-sussex,Help us build a community farm for the future ,Help us build a community farm for the future - a Food and Drink crowdfunding project in Arlington by Emily Huskins,2020-04-08T07:41:46+01:00,Help us build a community farm for the future,2020-04-08T07:41:46+01:00,Emily Huskins in,"Arlington, England, United Kingdom","3,082",3082,"raised of £4,000 stretch target",4000,"4,000 stretch",,supporters,77%,13 days left,Food and Drink,,,,
https://www.crowdfunder.co.uk/support-the-pen-museum,Support the Pen Museum! ,Support the Pen Museum! - a Charities crowdfunding project in Birmingham by The Pen Museum Team,2020-03-29T17:56:00+01:00,Support the Pen Museum!,2020-03-29T17:56:00+01:00,,,"3,059",3059,"raised of £3,500 stretch target",3500,"3,500 stretch",,supporters,87%,17 days left,Charities,Support the Pen Museum!,,,
https://www.crowdfunder.co.uk/beatnikznq,Beatnikz Republic Bar NQ ,Beatnikz Republic Bar NQ - a Food and Drink crowdfunding project in Manchester by Beatnikz Republic Bar NQ,46 days left,Beatnikz Republic Bar NQ,,Beatnikz Republic Bar NQ in,"Manchester, England, United Kingdom","3,045",3045,"raised of £5,000 target",5000,"5,000",49,supporters,60%,46 days left,Food and Drink,,,,
https://www.crowdfunder.co.uk/pt-cov19-face-shields-for-the-community,Face Shields for the Community ,Face Shields for the Community - a Community crowdfunding project in Portsmouth by Pete Turner,13 days left,Face Shields for the Community,,Pete Turner in,"Portsmouth, England, United Kingdom","3,024",3024,"raised of £1,000 stretch target",1000,"1,000 stretch",,supporters,302%,13 days left,Community,,,,
https://www.crowdfunder.co.uk/ms-uk-counselling,MS-UK Counselling ,MS-UK Counselling - a Charities crowdfunding project in United Kingdom by Diana Crowe,2020-03-03T23:59:59+00:00,MS-UK Counselling,2020-03-03T23:59:59+00:00,Diana Crowe in,United Kingdom,"3,019",3019,"raised of £5,000 target",5000,"5,000",34,supporters,60%,84 days left,Charities,,,,
https://www.crowdfunder.co.uk/todays-readers-tomorrows-leaders,"Today’s Readers, Tomorrow’s Leaders ","Today’s Readers, Tomorrow’s Leaders - a Schools crowdfunding project in Tewkesbury by Tewkesbury School",7 days left,"Today’s Readers, Tomorrow’s Leaders",,Tewkesbury School in,"Tewkesbury, England, United Kingdom","3,015",3015,"raised of £15,000 target",15000,"15,000",32,supporters,20%,7 days left,Schools,,,,
https://www.crowdfunder.co.uk/100-hours-of-conversation-1,100 Hours of Conversation ,100 Hours of Conversation - a Community crowdfunding project in Richmond by My Life Films,2020-04-03T17:06:16+01:00,100 Hours of Conversation,2020-04-03T17:06:16+01:00,My Life Films in,"Richmond, England, United Kingdom","3,005",3005,"raised of £5,000 target",5000,"5,000",51,supporters,60%,9 days left,Community,,,,
https://www.crowdfunder.co.uk/young-carers-get-active,Young carers 'Get Active' ,Young carers 'Get Active' - a Charities crowdfunding project in York by York Carers Centre,2020-03-04T23:59:00+00:00,Young carers 'Get Active',2020-03-04T23:59:00+00:00,York Carers Centre in,"York, England, United Kingdom","3,000",3000,"raised of £5,000 stretch target",5000,"5,000 stretch",,supporters,60%,84 days left,Charities,,,,
https://www.crowdfunder.co.uk/backthebaths,Back the Baths ,Back the Baths - a Community crowdfunding project in Manchester by Victoria Baths,2020-03-21T19:19:00+00:00,Back the Baths,2020-03-21T19:19:00+00:00,Victoria Baths in,"Manchester, England, United Kingdom","2,966",2966,"raised of £5,000 target",5000,"5,000",74,supporters,59%,23 days left,Community,,,,
https://www.crowdfunder.co.uk/pothecary-gin-rescue,Pothecary Gin Rescue ,Pothecary Gin Rescue - a Business crowdfunding project in Christchurch by Martin Jennings,14 days left,Pothecary Gin Rescue,,Martin Jennings in,"Christchurch, England, United Kingdom","2,959",2959,"raised of £6,000 target",6000,"6,000",43,supporters,49%,14 days left,Business,,,,
https://www.crowdfunder.co.uk/violence-awareness-programme,Parent/Carer Violence Awareness Programme ,Parent/Carer Violence Awareness Programme - a Community crowdfunding project in Bristol by Liam Blazeby,26 days left,Parent/Carer Violence Awareness Programme,,Liam Blazeby in,"Bristol, England, United Kingdom","2,925",2925,"raised of £3,000 target",3000,"3,000",12,supporters,97%,26 days left,Community,,,,
https://www.crowdfunder.co.uk/mindline-trans,MindLine Trans+ ,MindLine Trans+ - a Charities crowdfunding project in Bristol by Bristol Mind,2020-03-03T23:59:59+00:00,MindLine Trans+,2020-03-03T23:59:59+00:00,Bristol Mind in,"Bristol, England, United Kingdom","2,880",2880,"raised of £10,000 target",10000,"10,000",34,supporters,28%,84 days left,Charities,,,,
https://www.crowdfunder.co.uk/food-for-good-glasgow,Food For Good Glasgow ,Food For Good Glasgow - a Food and Drink crowdfunding project in Glasgow by Food For Good Coalition Glasgow,1 day left,Food For Good Glasgow,,Food For Good Coalition Glasgow in,"Glasgow, Scotland, United Kingdom","2,878",2878,"raised of £7,000 stretch target",7000,"7,000 stretch",,supporters,41%,1 day left,Food and Drink,,,,
https://www.crowdfunder.co.uk/empowerwomen,Livelihood training for tribal and disabled women ,Livelihood training for tribal and disabled women - a Arts crowdfunding project in India by Jitna Bhagani,2020-04-01T08:00:02+01:00,Livelihood training for tribal and disabled women,2020-04-01T08:00:02+01:00,Jitna Bhagani in,India,"2,860",2860,"raised of £4,730 target",4730,"4,730",56,supporters,60%,6 days left,Arts,,,,
https://www.crowdfunder.co.uk/virtualchickens,RCT Remote ,RCT Remote - Help us survive these crazy times! - a Community crowdfunding project in Dunblane by Rubber Chicken Theatre CIC (RCT),2020-03-24T12:06:30+00:00,RCT Remote - Help us survive these crazy times!,2020-03-24T12:06:30+00:00,Rubber Chicken Theatre CIC (RCT) in,"Dunblane, Scotland, United Kingdom","2,857",2857,"raised of £5,000 target",5000,"5,000",73,supporters,57%,27 days left,Community,,,,
https://www.crowdfunder.co.uk/support-windswept-and-join-the-party,"Support Windswept Brewing, join our Comeback Party ","Support Windswept Brewing, join our Comeback Party - a Business crowdfunding project in Lossiemouth by Windswept Brewing Co",7 days left,"Support Windswept Brewing, join our Comeback Party",,Windswept Brewing Co in,"Lossiemouth, Scotland, United Kingdom","2,855",2855,"raised of £5,000 target",5000,"5,000",52,supporters,57%,7 days left,Business,,,,
https://www.crowdfunder.co.uk/aspire360,ASPIRE360 Round Britain Challenge ,ASPIRE360 Round Britain Challenge - a Community crowdfunding project in Fowey by Fowey River,2020-03-02T13:46:00+00:00,ASPIRE360 Round Britain Challenge,2020-03-02T13:46:00+00:00,,,"2,822",2822,"raised of £30,000 target",30000,"30,000",49,supporters,9%,39 days left,Community,ASPIRE360 Round Britain Challenge,,,
https://www.crowdfunder.co.uk/good-to-grow-1,Good to Grow ,Good to Grow - a Food and Drink crowdfunding project in Belfast by Good to Grow,2020-03-17T13:46:00+00:00,Good to Grow,2020-03-17T13:46:00+00:00,Good to Grow in,"Belfast, Northern Ireland, United Kingdom","2,820",2820,"raised of £5,000 target",5000,"5,000",13,supporters,56%,37 days left,Food and Drink,,,,
https://www.crowdfunder.co.uk/irish-elders-corona-crisis-response,Irish Elders Corona Crisis Response ,Irish Elders Corona Crisis Response - a Community crowdfunding project in London by Molly Mulready,2020-04-11T12:59:36+01:00,Irish Elders Corona Crisis Response,2020-04-11T12:59:36+01:00,Molly Mulready in,"London, England, United Kingdom","2,790",2790,"raised of £10,000 target",10000,"10,000",86,supporters,27%,3 days left,Community,,,,
https://www.crowdfunder.co.uk/littlevillagehq,Families helping families: growing Little Village ,Families helping families: growing Little Village - a Community crowdfunding project in London by Little Village,2019-11-19T00:00:00+00:00,Families helping families: growing Little Village,2019-11-19T00:00:00+00:00,Little Village in,"London, England, United Kingdom","2,787",2787,"raised of £10,000 target",10000,"10,000",13,supporters,27%,26 days left,Community,,,,
https://www.crowdfunder.co.uk/tonyrefail-cluster-packed-lunch-providers,Tonyrefail Cluster Packed Lunch Providers ,Tonyrefail Cluster Packed Lunch Providers - a Community crowdfunding project in Tonyrefail by Leanne Parsons,42 days left,Tonyrefail Cluster Packed Lunch Providers,,Leanne Parsons in,"Tonyrefail, Wales, United Kingdom","2,785",2785,"raised of £20,000 target",20000,"20,000",70,supporters,13%,42 days left,Community,,,,
https://www.crowdfunder.co.uk/lets-get-ppe-to-frontline-nhs-key-workers,Lets get PPE to frontline NHS Key workers! ,Lets get PPE to frontline NHS Key workers! - a Business crowdfunding project in Exeter by Edwin Samkin,1 day left,Lets get PPE to frontline NHS Key workers!,,Edwin Samkin in,"Exeter, England, United Kingdom","2,775",2775,"raised of £3,000 stretch target",3000,"3,000 stretch",,supporters,93%,1 day left,Business,,,,
https://www.crowdfunder.co.uk/the-chequers-swinford-covid-19-we-will-survive,"The Chequers, Swinford COVID-19 we will survive ","The Chequers, Swinford COVID-19 we will survive - a Business crowdfunding project in Swinford by The Chequers, Swinford",37 days left,"The Chequers, Swinford COVID-19 we will survive",,"The Chequers, Swinford in","Swinford, England, United Kingdom","2,765",2765,"raised of £5,000 stretch target",5000,"5,000 stretch",,supporters,55%,37 days left,Business,,,,
https://www.crowdfunder.co.uk/bluesky-retreat,Bluesky Retreat ,Bluesky Retreat - a Charities crowdfunding project in Amesbury by Natalie Brannon,7 days left,Bluesky Retreat,,Natalie Brannon in,"Amesbury, England, United Kingdom","2,740",2740,"raised of £3,000 target",3000,"3,000",71,supporters,91%,7 days left,Charities,,,,
https://www.crowdfunder.co.uk/zenzero-drinks,Zenzero Soft Drink ,Zenzero Soft Drink - a Food and Drink crowdfunding project in London by Amie Gibba,13 days left,Zenzero Soft Drink,,Amie Gibba in,"London, England, United Kingdom","2,730",2730,"raised of £10,000 target",10000,"10,000",62,supporters,27%,13 days left,Food and Drink,,,,
https://www.crowdfunder.co.uk/keep-linton-lane-open,Fundraiser to keep Linton Lane open. ,Fundraiser to keep Linton Lane open. - a Charities crowdfunding project in Kirkcaldy by Linton Lane Centre,2020-04-11T11:33:40+01:00,Fundraiser to keep Linton Lane open.,2020-04-11T11:33:40+01:00,Linton Lane Centre in,"Kirkcaldy, Scotland, United Kingdom","2,722",2722,"raised of £10,000 target",10000,"10,000",89,supporters,27%,17 days left,Charities,,,,
https://www.crowdfunder.co.uk/ellees-hair-design-pay-it-forward,Ellee's Hair Design Pay It Forward ,Ellee's Hair Design Pay It Forward - a Business crowdfunding project in Aberdeen by Ellee's,22 days left,Ellee's Hair Design Pay It Forward,,Ellee's in,"Aberdeen, Scotland, United Kingdom","2,721",2721,"raised of £4,000 stretch target",4000,"4,000 stretch",,supporters,68%,22 days left,Business,,,,
https://www.crowdfunder.co.uk/town-house-coffee---prepaid-voucher,Town House Coffee ,Town House Coffee - Prepaid Voucher - a Food and Drink crowdfunding project in Preston by Bernice Marie Newton,1 day left,Town House Coffee - Prepaid Voucher,,Bernice Marie Newton in,"Preston, England, United Kingdom","2,720",2720,"raised of £3,500 target",3500,"3,500",100,supporters,77%,1 day left,Food and Drink,,,,
https://www.crowdfunder.co.uk/support-adam-handling-restaurant-group,Support Adam Handling Restaurant Group ,Support Adam Handling Restaurant Group - a Food and Drink crowdfunding project in London by Frog by Adam Handling,2020-03-25T18:13:28+00:00,Support Adam Handling Restaurant Group,2020-03-25T18:13:28+00:00,Frog by Adam Handling in,"London, England, United Kingdom","2,715",2715,"raised of £15,000 target",15000,"15,000",27,supporters,18%,7 hours left,Food and Drink,,,,
https://www.crowdfunder.co.uk/help-animals-globally-during-the-pandemic,Help Animals Globally During the Pandemic ,Help Animals Globally During the Pandemic - a Charities crowdfunding project in Cranborne by Worldwide Veterinary Service,5 days left,Help Animals Globally During the Pandemic,,Worldwide Veterinary Service in,"Cranborne, England, United Kingdom","2,701",2701,"raised of £5,000 target",5000,"5,000",76,supporters,54%,5 days left,Charities,,,,
https://www.crowdfunder.co.uk/save-totnes-rare-breeds,Save Totnes Rare Breeds! ,Save Totnes Rare Breeds! - a Business crowdfunding project in Littlehempston by Samantha Adams,34 days left,Save Totnes Rare Breeds!,,Samantha Adams in,"Littlehempston, England, United Kingdom","2,700",2700,"raised of £10,000 target",10000,"10,000",85,supporters,27%,34 days left,Business,,,,
https://www.crowdfunder.co.uk/make-education-accessible-to-families-in-need,Making education accessible to families in need ,Making education accessible to families in need - a Schools crowdfunding project in London by Moelis & Company,6 days left,Making education accessible to families in need,,Moelis & Company in,"London, England, United Kingdom","2,700",2700,"raised of £10,000 target",10000,"10,000",26,supporters,27%,6 days left,Schools,,,,
