URL,Headingonly,Title,DATE INDICATOR,Heading,Created,By,Location,Raised,raised as number,raised as words,target as number,Oftarget,Supporters,Supporters/investors,Timeleft 3,Timeleft 4,Category,Heading 2,Heading 3,Raisedby,Startedon
https://www.crowdfunder.co.uk/masks4nhsheroes,Personal Protective Equipment (PPE) for NHS Staff ,Personal Protective Equipment (PPE) for NHS Staff - a Charities crowdfunding project in London by Masks for NHS Heroes,2020-03-27T20:41:00+00:00,Personal Protective Equipment (PPE) for NHS Staff,2020-03-27T20:41:00+00:00,,,"2,023,574",2023574,"raised of £3,000,000 target",3000000,"3,000,000",34525,supporters,67%,15 days left,Charities,Personal Protective Equipment (PPE) for NHS Staff,,,
https://www.crowdfunder.co.uk/wheelsforheroes,WheelsForHeroes ,WheelsForHeroes - a Business crowdfunding project in London by Brompton Bike Hire,2020-04-02T12:00:00+01:00,WheelsForHeroes,2020-04-02T12:00:00+01:00,Brompton Bike Hire in,"London, England, United Kingdom","304,149",304149,"raised of £400,000 target",400000,"400,000",1713,supporters,76%,2 days left,Business,,,,
https://www.crowdfunder.co.uk/food4heroes,Food4Heroes ,Food4Heroes - Help Us Feed Frontline NHS Staff - a Charities crowdfunding project in United Kingdom by Food4Heroes,2020-04-07T23:55:00+01:00,Food4Heroes - Help Us Feed Frontline NHS Staff,2020-04-07T23:55:00+01:00,,,"193,360",193360,"raised of £400,000 target",400000,"400,000",786,supporters,48%,15 days left,Charities,Food4Heroes - Help Us Feed Frontline NHS Staff,,,
https://www.crowdfunder.co.uk/makehumanitygreatagain,#MakeHumanityGreatAgain ,#MakeHumanityGreatAgain - a Personal Causes crowdfunding project in London by Eddie Izzard,2020-01-31T23:55:00+00:00,#MakeHumanityGreatAgain,2020-01-31T23:55:00+00:00,Eddie Izzard in,"London, England, United Kingdom","141,351",141351,"raised of £150,000 stretch target",150000,"150,000 stretch",,supporters,94%,253 days left,Personal Causes,,,,
https://www.crowdfunder.co.uk/durhamcovid,County Durham Covid-19 Response Fund ,County Durham Covid-19 Response Fund - a Community crowdfunding project in Durham by Co Durham Community Foundation,2020-03-20T19:54:00+00:00,County Durham Covid-19 Response Fund,2020-03-20T19:54:00+00:00,Co Durham Community Foundation in,"Durham, England, United Kingdom","122,977",122977,"raised of £250,000 target",250000,"250,000",71,supporters,49%,23 days left,Community,,,,
https://www.crowdfunder.co.uk/masks-for-scotland,Masks for Scotland ,Masks for Scotland - a Charities crowdfunding project in Scone by Masks for Scotland,2020-04-08T19:19:13+01:00,Masks for Scotland,2020-04-08T19:19:13+01:00,Masks for Scotland in,"Scone, Scotland, United Kingdom","97,725",97725,"raised of £200,000 target",200000,"200,000",1367,supporters,48%,14 days left,Charities,,,,
https://www.crowdfunder.co.uk/feedthefrontline,Feed the Frontline ,Feed the Frontline - a Food and Drink crowdfunding project in United Kingdom by Feed the Frontline,9 days left,Feed the Frontline,,Feed the Frontline in,United Kingdom,"73,009",73009,"raised of £250,000 target",250000,"250,000",74,supporters,29%,9 days left,Food and Drink,,,,
https://www.crowdfunder.co.uk/eu-citizenship-is-a-permanent-status,EU Citizenship is a Permanent Status ,EU Citizenship is a Permanent Status - a Community crowdfunding project in Oxford by EU Citizenship:Permanent Status,16 days left,EU Citizenship is a Permanent Status,,EU Citizenship:Permanent Status in,"Oxford, England, United Kingdom","55,761",55761,"raised of £75,000 target",75000,"75,000",2376,supporters,74%,16 days left,Community,,,,
https://www.crowdfunder.co.uk/food4heroes-midlands-oxfordshire,Food4Heroes Midlands ,Food4Heroes Midlands - Feed The NHS - a crowdfunding project in Northampton by Food4Heroes,15 days left,Food4Heroes Midlands - Feed The NHS,,,,"54,789",54789,"raised of £100,000 target",100000,"100,000",53,supporters,54%,15 days left,Charities,,,,
https://www.crowdfunder.co.uk/support-dornoch-castle,Dornoch Castle needs you #Covid19 support fund ,Dornoch Castle needs you #Covid19 support fund - a Business crowdfunding project in Dornoch by Colin Thompson,2020-04-14T20:22:35+01:00,Dornoch Castle needs you #Covid19 support fund,2020-04-14T20:22:35+01:00,Colin Thompson in,"Dornoch, Scotland, United Kingdom","54,240",54240,"raised of £100,000 stretch target",100000,"100,000 stretch",,supporters,54%,13 days left,Business,,,,
https://www.crowdfunder.co.uk/trusselltrust,Trussell Trust food banks need your support ,Trussell Trust food banks need your support - a Charities crowdfunding project in United Kingdom by The Trussell Trust,23 days left,Trussell Trust food banks need your support,,,,"52,764",52764,"raised of £80,000 target",80000,"80,000",894,supporters,65%,23 days left,Charities,Trussell Trust food banks need your support,,,
https://www.crowdfunder.co.uk/wildheart-trust,SOS ,SOS - Save Our Animal Sanctuary - Covid19 Appeal - a Charities crowdfunding project in Sandown by The Wildheart Trust,2020-03-20T23:55:00+00:00,SOS - Save Our Animal Sanctuary - Covid19 Appeal,2020-03-20T23:55:00+00:00,The Wildheart Trust in,"Sandown, England, United Kingdom","45,232",45232,"raised of £75,000 target",75000,"75,000",1109,supporters,60%,15 days left,Charities,,,,
https://www.crowdfunder.co.uk/food4heroes-yorkshire,Food4Heroes Yorkshire ,Food4Heroes Yorkshire - Help Us Feed NHS Staff - a crowdfunding project in York by Food4Heroes,15 days left,Food4Heroes Yorkshire - Help Us Feed NHS Staff,,,,"45,004",45004,"raised of £100,000 target",100000,"100,000",97,supporters,45%,15 days left,Charities,,,,
https://www.crowdfunder.co.uk/plymouthargyle,Plymouth Argyle ,Plymouth Argyle - The Fans Crowdfunder - a Sports crowdfunding project in Plymouth by Plymouth Argyle,2020-03-21T15:30:00+00:00,Plymouth Argyle - The Fans Crowdfunder,2020-03-21T15:30:00+00:00,Plymouth Argyle in,"Plymouth, England, United Kingdom","43,907",43907,"raised of £50,000 target",50000,"50,000",374,supporters,87%,9 days left,Sports,,,,
https://www.crowdfunder.co.uk/fva-helping-hand,Helping Hand ,Helping Hand - a Community crowdfunding project in Glenrothes by Fife Voluntary Action,2 days left,Helping Hand,,Fife Voluntary Action in,"Glenrothes, Scotland, United Kingdom","42,244",42244,"raised of £50,000 stretch target",50000,"50,000 stretch",,supporters,84%,2 days left,Community,,,,
https://www.crowdfunder.co.uk/nspcc-pantosaurus-book,Help the NSPCC launch the Pantosaurus book ,Help the NSPCC launch the Pantosaurus book - a Community crowdfunding project in London by NSPCC,2020-02-03T23:55:00+00:00,Help the NSPCC launch the Pantosaurus book,2020-02-03T23:55:00+00:00,NSPCC in,"London, England, United Kingdom","42,084",42084,"raised of £50,000 target",50000,"50,000",1187,supporters,84%,8 days left,Community,,,,
https://www.crowdfunder.co.uk/help-the-holburne,Help the HOLBURNE through the corona crisis ,Help the HOLBURNE through the corona crisis - a Community crowdfunding project in Bath by Holburne Museum,21 days left,Help the HOLBURNE through the corona crisis,,Holburne Museum in,"Bath, England, United Kingdom","40,946",40946,"raised of £50,000 target",50000,"50,000",528,supporters,81%,21 days left,Community,,,,
https://www.crowdfunder.co.uk/wattwhiskycask,Help us bottle Watt Whisky's first Cask ,Help us bottle Watt Whisky's first Cask - a Food and Drink crowdfunding project in Campbeltown by Campbeltown Whisky Company Ltd.,2020-04-06T15:36:04+01:00,Help us bottle Watt Whisky's first Cask,2020-04-06T15:36:04+01:00,Campbeltown Whisky Company Ltd. in,"Campbeltown, Scotland, United Kingdom","35,371",35371,"raised of £31,250 stretch target",31250,"31,250 stretch",,supporters,113%,12 days left,Food and Drink,,,,
https://www.crowdfunder.co.uk/tis-the-future,Tis the Future ,Tis the Future - a Community crowdfunding project in Tisbury by Tisbury CBS,3 days left,Tis the Future,,Tisbury CBS in,"Tisbury, England, United Kingdom","33,925",33925,"raised of £75,000 target",75000,"75,000",85,investors,45%,3 days left,Community,,,,
https://www.crowdfunder.co.uk/bargeeast,Barge East ,Barge East - keep us afloat! - a Business crowdfunding project in London by Tommo Stuart Thomson,13 days left,Barge East - keep us afloat!,,Tommo Stuart Thomson in,"London, England, United Kingdom","32,477",32477,"raised of £27,000 stretch target",27000,"27,000 stretch",,supporters,120%,13 days left,Business,,,,
https://www.crowdfunder.co.uk/gowell,Go Well Fund ,"Go Well Fund - a Sports crowdfunding project in United Kingdom by Greg James, Jimmy & Felix",2020-04-11T17:22:00+01:00,Go Well Fund,2020-04-11T17:22:00+01:00,"Greg James, Jimmy & Felix in",United Kingdom,"32,304",32304,"raised of £40,000 target",40000,"40,000",1567,supporters,80%,16 days left,Sports,,,,
https://www.crowdfunder.co.uk/edinburgh-emergency-medical-supplies,Edinburgh Shield Force ,Edinburgh Shield Force - a Business crowdfunding project in Edinburgh by Edinburgh Shield Force,2020-04-02T09:57:05+01:00,Edinburgh Shield Force,2020-04-02T09:57:05+01:00,Edinburgh Shield Force in,"Edinburgh, Scotland, United Kingdom","32,150",32150,"raised of £35,000 stretch target",35000,"35,000 stretch",,supporters,92%,7 days left,Business,,,,
https://www.crowdfunder.co.uk/mucoronavirushardshipfund,Musicians' Union Coronavirus Hardship Fund ,Musicians' Union Coronavirus Hardship Fund - a Music crowdfunding project in London by Musicians’ Union (MU),2020-03-23T16:48:24+00:00,Musicians' Union Coronavirus Hardship Fund,2020-03-23T16:48:24+00:00,,,"31,866",31866,"raised of £100,000 stretch target",100000,"100,000 stretch",,supporters,32%,26 days left,Music,Musicians' Union Coronavirus Hardship Fund,,,
https://www.crowdfunder.co.uk/a-boost-for-the-brave,A Boost for the Brave ,A Boost for the Brave - a Social Enterprise crowdfunding project in London by Ashling,41 days left,A Boost for the Brave,,Ashling in,"London, England, United Kingdom","30,880",30880,"raised of £50,000 target",50000,"50,000",16,supporters,61%,41 days left,Social Enterprise,,,,
https://www.crowdfunder.co.uk/bridgingthegap,Bridging the Gap: Support Children in West London ,Bridging the Gap: Support Children in West London - a Community crowdfunding project in London by Kate Dolleymore,13 days left,Bridging the Gap: Support Children in West London,,Kate Dolleymore in,"London, England, United Kingdom","30,480",30480,"raised of £45,000 stretch target",45000,"45,000 stretch",,supporters,68%,13 days left,Community,,,,
https://www.crowdfunder.co.uk/yourneighbour,YourNeighbour.org ,YourNeighbour.org - a Charities crowdfunding project in London by YourNeighbour.org,2020-03-27T13:30:00+00:00,YourNeighbour.org,2020-03-27T13:30:00+00:00,YourNeighbour.org in,"London, England, United Kingdom","29,005",29005,"raised of £250,000 target",250000,"250,000",19,supporters,11%,38 days left,Charities,,,,
https://www.crowdfunder.co.uk/savecraving,Save Craving Coffee Tottenham ,Save Craving Coffee Tottenham - a Business crowdfunding project in London by Craving Coffee,2020-04-13T11:01:19+01:00,Save Craving Coffee Tottenham,2020-04-13T11:01:19+01:00,Craving Coffee in,"London, England, United Kingdom","27,431",27431,"raised of £40,000 stretch target",40000,"40,000 stretch",,supporters,69%,19 days left,Business,,,,
https://www.crowdfunder.co.uk/new-development-of-reusable-ppe-for-nhs-staff,New Development of Reusable PPE for NHS Staff ,New Development of Reusable PPE for NHS Staff - a Technology crowdfunding project in Headington by Oxford InSpired,2020-04-06T11:58:10+01:00,New Development of Reusable PPE for NHS Staff,2020-04-06T11:58:10+01:00,Oxford InSpired in,"Headington, England, United Kingdom","25,123",25123,"raised of £150,000 target",150000,"150,000",524,supporters,16%,12 days left,Technology,,,,
https://www.crowdfunder.co.uk/help-the-boileroom-survive-the-covid-19-crisis-1,Help The Boileroom survive the COVID-19 crisis! ,Help The Boileroom survive the COVID-19 crisis! - a Music crowdfunding project in Guildford by The Boileroom CIC,2020-03-17T16:35:48+00:00,Help The Boileroom survive the COVID-19 crisis!,2020-03-17T16:35:48+00:00,The Boileroom CIC in,"Guildford, England, United Kingdom","24,585",24585,"raised of £30,000 target",30000,"30,000",643,supporters,81%,20 days left,Music,,,,
https://www.crowdfunder.co.uk/last-stand,We are taking football to the STREETS!!! ,We are taking football to the STREETS!!! - a Community crowdfunding project in London by Gundeep Anand,2019-12-11T20:00:00+00:00,We are taking football to the STREETS!!!,2019-12-11T20:00:00+00:00,Gundeep Anand in,"London, England, United Kingdom","24,352",24352,"raised of £55,000 target",55000,"55,000",32,supporters,44%,64 days left,Community,,,,
https://www.crowdfunder.co.uk/feedcheltenham,FeedCheltenham ,FeedCheltenham - Local Charities Tackling Covid-19 - a Community crowdfunding project in Cheltenham by #FeedCheltenham,2020-03-26T16:44:00+00:00,FeedCheltenham - Local Charities Tackling Covid-19,2020-03-26T16:44:00+00:00,,,"23,956",23956,"raised of £25,000 target",25000,"25,000",274,supporters,95%,100 days left,Community,FeedCheltenham - Local Charities Tackling Covid-19,,,
https://www.crowdfunder.co.uk/keep-children-learning-covid-19-response,Keep Children Learning ,Keep Children Learning - Covid-19 Response - a Schools crowdfunding project in London by London Early Years Foundation,2020-03-26T15:31:00+00:00,Keep Children Learning - Covid-19 Response,2020-03-26T15:31:00+00:00,London Early Years Foundation in,"London, England, United Kingdom","23,741",23741,"raised of £50,000 stretch target",50000,"50,000 stretch",,supporters,47%,28 days left,Schools,,,,
https://www.crowdfunder.co.uk/food4heroes-south-west,Food4Heroes South West ,Food4Heroes South West - Help Us Feed NHS Staff - a crowdfunding project in Inwardleigh by Food4Heroes,15 days left,Food4Heroes South West - Help Us Feed NHS Staff,,,,"23,275",23275,"raised of £50,000 target",50000,"50,000",232,supporters,46%,15 days left,Charities,,,,
https://www.crowdfunder.co.uk/savetheparish,Save The Parish & Live Music In Huddersfield ,Save The Parish & Live Music In Huddersfield - a Music crowdfunding project in Huddersfield by Thomas Simpson,2020-03-17T17:30:00+00:00,Save The Parish & Live Music In Huddersfield,2020-03-17T17:30:00+00:00,Thomas Simpson in,"Huddersfield, England, United Kingdom","23,210",23210,"raised of £25,000 target",25000,"25,000",589,supporters,92%,9 days left,Music,,,,
https://www.crowdfunder.co.uk/homeforgood,Emergency Coronavirus Appeal ,Emergency Coronavirus Appeal - a Charities crowdfunding project in United Kingdom by Home for Good,2020-04-09T17:14:26+01:00,Emergency Coronavirus Appeal,2020-04-09T17:14:26+01:00,Home for Good in,United Kingdom,"20,873",20873,"raised of £25,000 target",25000,"25,000",174,supporters,83%,15 days left,Charities,,,,
https://www.crowdfunder.co.uk/stpetrocscovid19appeal,St Petrocs COVID-19 Homeless Emergency Appeal ,St Petrocs COVID-19 Homeless Emergency Appeal - a Charities crowdfunding project in Truro by St Petrocs,33 days left,St Petrocs COVID-19 Homeless Emergency Appeal,,St Petrocs in,"Truro, England, United Kingdom","20,600",20600,"raised of £30,000 target",30000,"30,000",283,supporters,68%,33 days left,Charities,,,,
https://www.crowdfunder.co.uk/helpthelightgetin,#HelpHowTheLightGetsIn ,#HelpHowTheLightGetsIn - a Arts crowdfunding project in United Kingdom by Art and Ideas Trust,15 days left,#HelpHowTheLightGetsIn,,Art and Ideas Trust in,United Kingdom,"20,398",20398,"raised of £100,000 target",100000,"100,000",84,supporters,20%,15 days left,Arts,,,,
https://www.crowdfunder.co.uk/nottscounty,Support Notts County and Age UK ,Support Notts County and Age UK - a Business crowdfunding project in Nottingham by Notts County Football Club,7 days left,Support Notts County and Age UK,,Notts County Football Club in,"Nottingham, England, United Kingdom","20,334",20334,"raised of £25,000 stretch target",25000,"25,000 stretch",,supporters,81%,7 days left,Business,,,,
https://www.crowdfunder.co.uk/kentishtowncityfarm,Kentish Town City Farm Appeal ,Kentish Town City Farm Appeal - a Community crowdfunding project in London by Claire Probets,2020-04-14T21:11:05+01:00,Kentish Town City Farm Appeal,2020-04-14T21:11:05+01:00,Claire Probets in,"London, England, United Kingdom","20,030",20030,"raised of £25,000 target",25000,"25,000",221,supporters,80%,20 days left,Community,,,,
https://www.crowdfunder.co.uk/staying-connected-covid-19-match-funded-appeal-south-london-cares,Staying connected: COVID-19 match-funded appeal ,Staying connected: COVID-19 match-funded appeal - a Community crowdfunding project in London by Jodie Goffe,2020-03-18T21:42:00+00:00,Staying connected: COVID-19 match-funded appeal,2020-03-18T21:42:00+00:00,Jodie Goffe in,"London, England, United Kingdom","19,792",19792,"raised of £20,000 stretch target",20000,"20,000 stretch",,supporters,99%,6 days left,Community,,,,
https://www.crowdfunder.co.uk/coventryrugbycrowdfunder,Coventry Rugby ,Coventry Rugby - Crowdfunder - a Business crowdfunding project in Coventry by Coventry Rugby,2020-04-16T12:23:55+01:00,Coventry Rugby - Crowdfunder,2020-04-16T12:23:55+01:00,Coventry Rugby in,"Coventry, England, United Kingdom","19,658",19658,"raised of £30,000 target",30000,"30,000",168,supporters,65%,50 days left,Business,,,,
https://www.crowdfunder.co.uk/challengers-emergency-appeal,Prevent isolation! Challengers Emergency Appeal ,Prevent isolation! Challengers Emergency Appeal - a Community crowdfunding project in Guildford by Challengers,2020-04-09T17:22:25+01:00,Prevent isolation! Challengers Emergency Appeal,2020-04-09T17:22:25+01:00,,,"19,079",19079,"raised of £150,000 target",150000,"150,000",614,supporters,12%,43 days left,Community,Prevent isolation! Challengers Emergency Appeal,,,
https://www.crowdfunder.co.uk/friends-of-tower-hamlets-cemetery-park-survival-appeal,We need your help ,We need your help - The Friends' survival appeal - a Community crowdfunding project in London by Tower Hamlets Cemetery Park,2020-03-24T07:00:02+00:00,We need your help - The Friends' survival appeal,2020-03-24T07:00:02+00:00,,,"18,844",18844,"raised of £20,000 stretch target",20000,"20,000 stretch",,supporters,94%,26 days left,Community,We need your help - The Friends' survival appeal,,,
https://www.crowdfunder.co.uk/towersey-festival,Securing the future of Towersey Festival ,Securing the future of Towersey Festival - a Music crowdfunding project in Middle Claydon by Towersey Festival,2020-04-09T07:58:02+01:00,Securing the future of Towersey Festival,2020-04-09T07:58:02+01:00,Towersey Festival in,"Middle Claydon, England, United Kingdom","18,727",18727,"raised of £25,000 target",25000,"25,000",436,supporters,74%,14 days left,Music,,,,
https://www.crowdfunder.co.uk/20f732b505c0eda8d45e06ee5cc10677,"Le Vacherin Chiswick, donate and receive rewards! ","Le Vacherin Chiswick, donate and receive rewards! - a Food and Drink crowdfunding project in London by Le Vacherin Restaurant",2020-04-04T15:19:00+01:00,"Le Vacherin Chiswick, donate and receive rewards!",2020-04-04T15:19:00+01:00,Le Vacherin Restaurant in,"London, England, United Kingdom","18,699",18699,"raised of £35,000 target",35000,"35,000",241,supporters,53%,23 days left,Food and Drink,,,,
https://www.crowdfunder.co.uk/estuary-appeal,"Estuary League Of Friends Emergency Appeal, Devon ","Estuary League Of Friends Emergency Appeal, Devon - a Charities crowdfunding project in Topsham by Rachel Gilpin, CEO",19 days left,"Estuary League Of Friends Emergency Appeal, Devon",,,,"18,466",18466,"raised of £60,000 target",60000,"60,000",243,supporters,30%,19 days left,Charities,"Estuary League Of Friends Emergency Appeal, Devon",,,
https://www.crowdfunder.co.uk/help-rebuild-st-pauls-adventure-playground,Help Rebuild St Pauls Adventure Playground ,Help Rebuild St Pauls Adventure Playground - a Community crowdfunding project in St. Philips Marsh by Stan Jones,24 days left,Help Rebuild St Pauls Adventure Playground,,Stan Jones in,"St. Philips Marsh, England, United Kingdom","18,442",18442,"raised of £25,000 stretch target",25000,"25,000 stretch",,supporters,74%,24 days left,Community,,,,
https://www.crowdfunder.co.uk/save-revival-retro,Save Revival Retro: a unique independent shop ,Save Revival Retro: a unique independent shop - a Business crowdfunding project in London by Rowena Howie,2020-04-05T20:38:04+01:00,Save Revival Retro: a unique independent shop,2020-04-05T20:38:04+01:00,Rowena Howie in,"London, England, United Kingdom","18,230",18230,"raised of £25,000 target",25000,"25,000",269,supporters,72%,4 days left,Business,,,,
https://www.crowdfunder.co.uk/help-the-wilderness,Help The Wilderness ,Help The Wilderness - a Food and Drink crowdfunding project in Birmingham by Alex Claridge,8 days left,Help The Wilderness,,Alex Claridge in,"Birmingham, England, United Kingdom","18,078",18078,"raised of £20,000 stretch target",20000,"20,000 stretch",,supporters,90%,8 days left,Food and Drink,,,,
https://www.crowdfunder.co.uk/fund-our-investigation-into-the-daily-mail,Fund an Investigation into Crime at the Daily Mail ,Fund an Investigation into Crime at the Daily Mail - a Publishing crowdfunding project in London by BYLINE INVESTIGATES,2019-10-26T23:59:00+01:00,Fund an Investigation into Crime at the Daily Mail,2019-10-26T23:59:00+01:00,BYLINE INVESTIGATES in,"London, England, United Kingdom","17,733",17733,"raised of £30,000 target",30000,"30,000",148,supporters,59%,8 days left,Publishing,,,,
https://www.crowdfunder.co.uk/womensequalitylondon2020,Help the Women’s Equality Party win in London 2021 ,Help the Women’s Equality Party win in London 2021 - a Politics crowdfunding project in London by Women's Equality Party,2020-02-14T23:55:00+00:00,Help the Women’s Equality Party win in London 2021,2020-02-14T23:55:00+00:00,Women's Equality Party in,"London, England, United Kingdom","17,586",17586,"raised of £35,000 target",35000,"35,000",212,supporters,50%,131 days left,Politics,,,,
https://www.crowdfunder.co.uk/supportworkers,Covid19: Food & vital supplies for migrant workers ,Covid19: Food & vital supplies for migrant workers - a Community crowdfunding project in Manchester by Ethical Consumer,2020-04-16T14:43:35+01:00,Covid19: Food & vital supplies for migrant workers,2020-04-16T14:43:35+01:00,Ethical Consumer in,"Manchester, England, United Kingdom","16,944",16944,"raised of £20,000 target",20000,"20,000",542,supporters,84%,29 days left,Community,,,,
https://www.crowdfunder.co.uk/keep-craufurd-alive,Help Craufurd and its Staff Survive the Covid-19 ,Help Craufurd and its Staff Survive the Covid-19 - a Music crowdfunding project in Wolverton by TheCraufurdArms,21 days left,Help Craufurd and its Staff Survive the Covid-19,,TheCraufurdArms in,"Wolverton, England, United Kingdom","16,018",16018,"raised of £30,000 target",30000,"30,000",426,supporters,53%,21 days left,Music,,,,
https://www.crowdfunder.co.uk/savedownhillsparkcafe,Save Downhills Park Cafe ,Save Downhills Park Cafe - a Business crowdfunding project in London by Neri Gun,2020-04-20T17:53:48+01:00,Save Downhills Park Cafe,2020-04-20T17:53:48+01:00,Neri Gun in,"London, England, United Kingdom","15,660",15660,"raised of £25,000 target",25000,"25,000",489,supporters,62%,26 days left,Business,,,,
https://www.crowdfunder.co.uk/lifting-up-our-community,LIFTING up our Community ,LIFTING up our Community - a Community crowdfunding project in Thringstone by Tom Walters,84 days left,LIFTING up our Community,,Tom Walters in,"Thringstone, England, United Kingdom","15,535",15535,"raised of £40,000 stretch target",40000,"40,000 stretch",,supporters,39%,84 days left,Community,,,,
https://www.crowdfunder.co.uk/hastings-foodbank-covid19-crisis-appeal,Hastings Foodbank ,Hastings Foodbank - Covid19 Crisis Appeal - a Community crowdfunding project in Hastings by Hastings Foodbank,23 days left,Hastings Foodbank - Covid19 Crisis Appeal,,Hastings Foodbank in,"Hastings, England, United Kingdom","15,370",15370,"raised of £18,000 target",18000,"18,000",216,supporters,85%,23 days left,Community,,,,
https://www.crowdfunder.co.uk/battersea-zoo-crowdfunder,Battersea Park Children's Zoo Crowdfunder ,Battersea Park Children's Zoo Crowdfunder - a Business crowdfunding project in London by Battersea Park Children's Zoo,8 days left,Battersea Park Children's Zoo Crowdfunder,,Battersea Park Children's Zoo in,"London, England, United Kingdom","15,203",15203,"raised of £10,000 stretch target",10000,"10,000 stretch",,supporters,152%,8 days left,Business,,,,
https://www.crowdfunder.co.uk/wimbledonfoodbank,Wimbledon Foodbank ,Wimbledon Foodbank - Covid19 Crisis Appeal - a Charities crowdfunding project in London by Wimbledon Foodbank,2020-03-20T17:42:00+00:00,Wimbledon Foodbank - Covid19 Crisis Appeal,2020-03-20T17:42:00+00:00,Wimbledon Foodbank in,"London, England, United Kingdom","14,919",14919,"raised of £20,000 target",20000,"20,000",273,supporters,74%,10 days left,Charities,,,,
https://www.crowdfunder.co.uk/grassington-house-coronavirus19-support-us,"Grassington House, Coronavirus19 support us. ","Grassington House, Coronavirus19 support us. - a Business crowdfunding project in Grassington by Grassington House-John Rudden",2020-04-06T12:05:03+01:00,"Grassington House, Coronavirus19 support us.",2020-04-06T12:05:03+01:00,Grassington House-John Rudden in,"Grassington, England, United Kingdom","14,810",14810,"raised of £45,000 target",45000,"45,000",113,supporters,32%,26 days left,Business,,,,
https://www.crowdfunder.co.uk/nhs-frontline-immune-support,Frontline Immune Support for NHS Staff ,Frontline Immune Support for NHS Staff - a Community crowdfunding project in London by Frontline Immune Support,9 days left,Frontline Immune Support for NHS Staff,,Frontline Immune Support in,"London, England, United Kingdom","14,315",14315,"raised of £50,000 target",50000,"50,000",336,supporters,28%,9 days left,Community,,,,
